"id","titulo","ano","issn","titulo_serie","editora","autor","url"
"9781437709209","Equine Dermatology (Second Edition)",2011,,,"W.B. Saunders",,"http://www.sciencedirect.com/science/book/9781437709209"
"9780444531131","Pyrolysis of Organic Molecules with Applications to Health and Environmental Issues",2010,"0167-9244","Techniques and Instrumentation in Analytical Chemistry","Elsevier",,"http://www.sciencedirect.com/science/book/9780444531131"
"9780123846778","The Agronomy and Economy of Important Tree Crops of the Developing World",2010,,,"Elsevier",,"http://www.sciencedirect.com/science/book/9780123846778"
"9780123809247","Enzyme Kinetics: Catalysis & Control",2010,,,"Elsevier",,"http://www.sciencedirect.com/science/book/9780123809247"
"9780444531797","Advances in Nanoporous Materials",2010,"1878-7959","Advances in Nanoporous Materials","Elsevier",,"http://www.sciencedirect.com/science/book/9780444531797"
"9780123750792","Physically Based Rendering (Second Edition)",2010,,,"Morgan Kaufmann",,"http://www.sciencedirect.com/science/book/9780123750792"
"9780123751652","Interconnecting Smart Objects with IP",2010,,,"Morgan Kaufmann",,"http://www.sciencedirect.com/science/book/9780123751652"
"9780123756954","Making EIM Enterprise Information Management Work for Business",2010,,,"Morgan Kaufmann",,"http://www.sciencedirect.com/science/book/9780123756954"
"9780123820884","Integrated Reservoir Asset Management",2010,,,"Gulf Professional Publishing",,"http://www.sciencedirect.com/science/book/9780123820884"
"9780123821027","Up and Running with Autodesk Inventor Simulation 2011 (Second Edition)",2010,,,"Butterworth-Heinemann",,"http://www.sciencedirect.com/science/book/9780123821027"
"9780815520450","Electrical Codes, Standards, Recommended Practices and Regulations",2010,,,"William Andrew Publishing",,"http://www.sciencedirect.com/science/book/9780815520450"
"9781856176545","Electrical Safety Code Manual",2010,,,"Butterworth-Heinemann",,"http://www.sciencedirect.com/science/book/9781856176545"
"9781856178044","Sustainable Communities Design Handbook",2010,,,"Butterworth-Heinemann",,"http://www.sciencedirect.com/science/book/9781856178044"
"9780123846914","New Insights to Neuroimmune Biology",2010,,,"Elsevier",,"http://www.sciencedirect.com/science/book/9780123846914"
"9780123741776","Bayley-III Clinical Use and Interpretation",2010,,,"Academic Press",,"http://www.sciencedirect.com/science/book/9780123741776"
"9780080449364","Technologically Enhanced Natural Radiation",2010,"1569-4860","Radioactivity in the Environment","Elsevier",,"http://www.sciencedirect.com/science/book/9780080449364"
"9781416060680","MULTIPLE SCLEROSIS 3",2010,"1877-184X","Blue Books of Neurology","Butterworth-Heinemann",,"http://www.sciencedirect.com/science/book/9781416060680"
"9781416066415","MOVEMENT DISORDERS 4",2010,"1877-184X","Blue Books of Neurology","Butterworth-Heinemann",,"http://www.sciencedirect.com/science/book/9781416066415"
"9780444531414","{Handbook of Dynamical Systems, Volume 3}",2010,"1874-575X","Handbook of Dynamical Systems","Elsevier Science",,"http://www.sciencedirect.com/science/book/9780444531414"
"9780123851482","Introduction to Practice of Molecular Simulation",2011,,,"Elsevier",,"http://www.sciencedirect.com/science/book/9780123851482"
"9780123848901","Genetics and Evolution of Infectious Diseases",2011,,,"Elsevier",,"http://www.sciencedirect.com/science/book/9780123848901"
"9780123820068","Microbial Forensics (Second Edition)",2011,,,"Academic Press",,"http://www.sciencedirect.com/science/book/9780123820068"
"9780444530820","Handbook of Flotation Reagents: Chemistry, Theory and Practice",2010,,,"Elsevier",,"http://www.sciencedirect.com/science/book/9780444530820"
"9780123750921","Usability Testing Essentials",2011,,,"Morgan Kaufmann",,"http://www.sciencedirect.com/science/book/9780123750921"
"9781597494861","A Guide to Kernel Exploitation",2011,,,"Syngress",,"http://www.sciencedirect.com/science/book/9781597494861"
"9781597495820","Citrix XenDesktop Implementation",2010,,,"Syngress",,"http://www.sciencedirect.com/science/book/9781597495820"
"9781597495943","Security for Microsoft Windows System Administrators",2011,,,"Syngress",,"http://www.sciencedirect.com/science/book/9781597495943"
"9780444528582","Coal and Peat Fires: A Global Perspective",2010,,,"Elsevier",,"http://www.sciencedirect.com/science/book/9780444528582"
"9781437778489","Integrated Nanophotonic Devices",2010,,,"William Andrew Publishing",,"http://www.sciencedirect.com/science/book/9781437778489"
"9780444508973","Handbook of Financial Econometrics Tools and Techniques",2010,,,"North-Holland",,"http://www.sciencedirect.com/science/book/9780444508973"
"9780444535481","Handbook of Financial Econometrics Applications",2010,,,"Elsevier",,"http://www.sciencedirect.com/science/book/9780444535481"
"9780123848765","American Trypanosomiasis",2010,,,"Elsevier",,"http://www.sciencedirect.com/science/book/9780123848765"
"9780123751546","Manual of Pediatric Hematology and Oncology (Fifth Edition)",2011,,,"Academic Press",,"http://www.sciencedirect.com/science/book/9780123751546"
"9780123849663","Lectures on Dynamics of Stochastic Systems",2011,,,"Elsevier",,"http://www.sciencedirect.com/science/book/9780123849663"
"9780123786388","Handbook of the Biology of Aging (Seventh Edition)",2011,,"Handbooks of Aging","Academic Press",,"http://www.sciencedirect.com/science/book/9780123786388"
"9780444534392","Compendium of Trace Metals and Marine Biota",2010,,,"Elsevier",,"http://www.sciencedirect.com/science/book/9780444534392"
"9780123748997","Smart Things",2010,,,"Morgan Kaufmann",,"http://www.sciencedirect.com/science/book/9780123748997"
"9781597495639","CISSP Study Guide",2010,,,"Syngress",,"http://www.sciencedirect.com/science/book/9781597495639"
"9781856177528","Space Safety Regulations and Standards",2011,,,"Butterworth-Heinemann",,"http://www.sciencedirect.com/science/book/9781856177528"
"9780123820006","Forensic Dental Evidence (Second Edition)",2010,,,"Academic Press",,"http://www.sciencedirect.com/science/book/9780123820006"
"9780123749338","Forms for the Therapist",2010,,,"Academic Press",,"http://www.sciencedirect.com/science/book/9780123749338"
"9780123814531","Handbook on Animal-Assisted Therapy (Third Edition)",2010,,,"Academic Press",,"http://www.sciencedirect.com/science/book/9780123814531"
"9780444532619","Synchrotron-Based Techniques in Soils and Sediments",2010,"0166-2481","Developments in Soil Science","Elsevier",,"http://www.sciencedirect.com/science/book/9780444532619"
"9780444535269","Carbonates in Continental Settings: Geochemistry, Diagenesis and Applications",2010,"0070-4571","Developments in Sedimentology","Elsevier",,"http://www.sciencedirect.com/science/book/9780444535269"
"9780444529947","Principles of Electric Methods in Surface and Borehole Geophysics",2010,"0076-6895","Methods in Geochemistry and Geophysics","Elsevier",,"http://www.sciencedirect.com/science/book/9780444529947"
"9781597495707","Securing the Smart Grid",2011,,,"Syngress",,"http://www.sciencedirect.com/science/book/9781597495707"
"9781597495745","Managed Code Rootkits",2011,,,"Syngress",,"http://www.sciencedirect.com/science/book/9781597495745"
"9780123809285","Regenerative Nephrology",2011,,,"Academic Press",,"http://www.sciencedirect.com/science/book/9780123809285"
"9780123756749","Mouse Behavioral Testing",2011,,,"Academic Press",,"http://www.sciencedirect.com/science/book/9780123756749"
"9780444535566","Handbook of Spent Hydroprocessing Catalysts",2010,,,"Elsevier",,"http://www.sciencedirect.com/science/book/9780444535566"
"9780444520159","Bacterial Infections of the Central Nervous System",2010,"0072-9752","Handbook of Clinical Neurology","Elsevier",,"http://www.sciencedirect.com/science/book/9780444520159"
"9780125286299","Nonlinear Ocean Waves and the Inverse Scattering Transform",2010,"0074-6142","International Geophysics","Academic Press",,"http://www.sciencedirect.com/science/book/9780125286299"
"9780444530455","The Mrdalsjkull Ice Cap, Iceland. Glacial processes, sediments and landforms on an active volcano",2010,"1571-0866","Developments in Quaternary Sciences","Elsevier",,"http://www.sciencedirect.com/science/book/9780444530455"
"9781437778137","Red Panda",2011,,,"William Andrew Publishing",,"http://www.sciencedirect.com/science/book/9781437778137"
"9780123815354","Stem Cells: Scientific Facts and Fiction",2011,,,"Academic Press",,"http://www.sciencedirect.com/science/book/9780123815354"
"9780123737175","The Practitioner's Guide to Data Quality Improvement",2011,,"MK Series on Business Intelligence","Morgan Kaufmann",,"http://www.sciencedirect.com/science/book/9780123737175"
"9780815520498","Coal Gasification and Its Applications",2010,,,"William Andrew Publishing",,"http://www.sciencedirect.com/science/book/9780815520498"
"9780750686327","Handbook of Industrial Hydrocarbon Processes",2011,,,"Gulf Professional Publishing",,"http://www.sciencedirect.com/science/book/9780750686327"
"9780122499517","Virus Taxonomy: Eighth Report of the International Committee on Taxonomy of Viruses",2005,,,"Academic Press",,"http://www.sciencedirect.com/science/book/9780122499517"
"9780123748829","Mathematics for Neuroscientists",2010,,,"Academic Press",,"http://www.sciencedirect.com/science/book/9780123748829"
"9780123750969","Social Anxiety (Second Edition)",2010,,,"Academic Press",,"http://www.sciencedirect.com/science/book/9780123750969"
"9780444534248","Advances in Quaternary Entomology",2010,"1571-0866","Developments in Quaternary Sciences","Elsevier",,"http://www.sciencedirect.com/science/book/9780444534248"
"9780123744203","Olives and Olive Oil in Health and Disease Prevention",2010,,,"Academic Press",,"http://www.sciencedirect.com/science/book/9780123744203"
"9780444532343","Cereal Straw as a Resource for Sustainable Biomaterials and Biofuels",2010,,,"Elsevier",,"http://www.sciencedirect.com/science/book/9780444532343"
"9780123738660","Nitric Oxide (Second Edition)",2010,,,"Academic Press",,"http://www.sciencedirect.com/science/book/9780123738660"
"9780444527851","Fundamentals of Petroleum Refining",2010,,,"Elsevier",,"http://www.sciencedirect.com/science/book/9780444527851"
"9780444530288","Thermodynamics of Non-Equilibrium Processes for Chemists with a Particular Application to Catalysis",2010,,,"Elsevier",,"http://www.sciencedirect.com/science/book/9780444530288"
"9780123748928","Beyond the Usability Lab",2010,,,"Morgan Kaufmann",,"http://www.sciencedirect.com/science/book/9780123748928"
"9780123749215","Design to Thrive",2010,,,"Morgan Kaufmann",,"http://www.sciencedirect.com/science/book/9780123749215"
"9780123750303","Designing with the Mind in Mind",2010,,,"Morgan Kaufmann",,"http://www.sciencedirect.com/science/book/9780123750303"
"9781597494977","Eleventh Hour Linux+",2010,,,"Syngress",,"http://www.sciencedirect.com/science/book/9781597494977"
"9781597494991","PCI Compliance (Second Edition)",2010,,,"Syngress",,"http://www.sciencedirect.com/science/book/9781597494991"
"9781597495431","Seven Deadliest Web Application Attacks",2010,,,"Syngress",,"http://www.sciencedirect.com/science/book/9781597495431"
"9781597495516","Seven Deadliest Microsoft Attacks",2010,,,"Syngress",,"http://www.sciencedirect.com/science/book/9781597495516"
"9781856177474","Digital Video Surveillance and Security",2010,,,"Butterworth-Heinemann",,"http://www.sciencedirect.com/science/book/9781856177474"
"9780080964461","Handbook of Pollution Prevention and Cleaner Production",2010,,,"William Andrew Publishing",,"http://www.sciencedirect.com/science/book/9780080964461"
"9780123744869","Introduction to Pattern Recognition",2010,,,"Academic Press",,"http://www.sciencedirect.com/science/book/9780123744869"
"9780123747839","Essential Mathcad for Engineering, Science, and Math (Second Edition)",2009,,,"Academic Press",,"http://www.sciencedirect.com/science/book/9780123747839"
"9780123748799","OFDM for Optical Communications",2010,,,"Academic Press",,"http://www.sciencedirect.com/science/book/9780123748799"
"9780123748836","Essential Matlab for Engineers and Scientists (Fourth Edition)",2010,,,"Academic Press",,"http://www.sciencedirect.com/science/book/9780123748836"
"9780123749505","Optical Performance Monitoring",2010,,,"Academic Press",,"http://www.sciencedirect.com/science/book/9780123749505"
"9781597492720","Pattern Recognition (Fourth Edition)",2009,,,"Academic Press",,"http://www.sciencedirect.com/science/book/9781597492720"
"9781856174978","Materials and Design (Second Edition)",2010,,,"Butterworth-Heinemann",,"http://www.sciencedirect.com/science/book/9781856174978"
"9781856175487","Construction Process Planning and Management",2009,,,"Butterworth-Heinemann",,"http://www.sciencedirect.com/science/book/9781856175487"
"9781856176002","Well Testing Project Management",2009,,,"Gulf Professional Publishing",,"http://www.sciencedirect.com/science/book/9781856176002"
"9781856176057","Hardware/Firmware Interface Design",2010,,,"Newnes",,"http://www.sciencedirect.com/science/book/9781856176057"
"9781856176620","Integrated Design of Multiscale, Multifunctional Materials and Products",2010,,,"Butterworth-Heinemann",,"http://www.sciencedirect.com/science/book/9781856176620"
"9781856176767","Green Construction Project Management and Cost Oversight",2010,,,"Architectural Press",,"http://www.sciencedirect.com/science/book/9781856176767"
"9781856176910","LEED Practices, Certification, and Accreditation Handbook",2009,,,"Butterworth-Heinemann",,"http://www.sciencedirect.com/science/book/9781856176910"
"9781856176934","Piping and Pipeline Calculations Manual",2010,,,"Butterworth-Heinemann",,"http://www.sciencedirect.com/science/book/9781856176934"
"9781856177061","FPGAs 101",2010,,,"Newnes",,"http://www.sciencedirect.com/science/book/9781856177061"
"9781856177122","The Safety Relief Valve Handbook",2010,,,"Butterworth-Heinemann",,"http://www.sciencedirect.com/science/book/9781856177122"
"9781856177191","SD Card Projects Using the PIC Microcontroller",2010,,,"Newnes",,"http://www.sciencedirect.com/science/book/9781856177191"
"9781856177504","Designing Embedded Systems with PIC Microcontrollers (Second Edition)",2010,,,"Newnes",,"http://www.sciencedirect.com/science/book/9781856177504"
"9781856177627","Robert Lacoste's The Darker Side",2010,,,"Newnes",,"http://www.sciencedirect.com/science/book/9781856177627"
"9781856177719","Structural Elements for Architects and Builders",2010,,,"Butterworth-Heinemann",,"http://www.sciencedirect.com/science/book/9781856177719"
"9781856177979","Sustainable Land Development and Restoration",2010,,,"Butterworth-Heinemann",,"http://www.sciencedirect.com/science/book/9781856177979"
"9781856178280","Working Guide to Pumps and Pumping Stations",2010,,,"Gulf Professional Publishing",,"http://www.sciencedirect.com/science/book/9781856178280"
"9781856179638","The Definitive Guide to the ARM Cortex-M3 (Second Edition)",2010,,,"Newnes",,"http://www.sciencedirect.com/science/book/9781856179638"
"9780123748553","Ecology and Classification of North American Freshwater Invertebrates (Third Edition)",2009,,,"Academic Press",,"http://www.sciencedirect.com/science/book/9780123748553"
"9780123745033","An Introduction to Investment Banks, Hedge Funds, and Private Equity",2010,,,"Academic Press",,"http://www.sciencedirect.com/science/book/9780123745033"
"9780126410037","Global Bank Regulation",2010,,,"Academic Press",,"http://www.sciencedirect.com/science/book/9780126410037"
"9780123757289","Crime Scene Photography (Second Edition)",2010,,,"Academic Press",,"http://www.sciencedirect.com/science/book/9780123757289"
"9780815520276","Plastics in Medical Devices",2010,,"Plastics Design Library","William Andrew Publishing",,"http://www.sciencedirect.com/science/book/9780815520276"
"9780123742711","Principles of Gender-Specific Medicine (Second Edition)",2010,,,"Academic Press",,"http://www.sciencedirect.com/science/book/9780123742711"
"9780123746023","Osteoporosis in Men (Second Edition)",2010,,,"Academic Press",,"http://www.sciencedirect.com/science/book/9780123746023"
"9781856175470","The Law of Emergencies",2009,,,"Butterworth-Heinemann",,"http://www.sciencedirect.com/science/book/9781856175470"
"9781856176125","Disasters and Public Health",2009,,,"Butterworth-Heinemann",,"http://www.sciencedirect.com/science/book/9781856176125"
"9781856176132","Hospital and Healthcare Security (Fifth Edition)",2010,,,"Butterworth-Heinemann",,"http://www.sciencedirect.com/science/book/9781856176132"
"9781856177016","Hospital Emergency Response Teams",2010,,,"Butterworth-Heinemann",,"http://www.sciencedirect.com/science/book/9781856177016"
"9780123749512","Mechanisms of Memory (Second Edition)",2010,,,"Academic Press",,"http://www.sciencedirect.com/science/book/9780123749512"
"9780124967366","Principles of Addictions and the Law",2010,,,"Academic Press",,"http://www.sciencedirect.com/science/book/9780124967366"
"9781597495370","Digital Forensics for Network, Internet, and Cloud Computing",2010,,,"Syngress",,"http://www.sciencedirect.com/science/book/9781597495370"
"9781597495783","Microsoft Windows Server 2008 R2",2010,,,"Syngress",,"http://www.sciencedirect.com/science/book/9781597495783"
"9781597495967","Digital Triage Forensics",2010,,,"Syngress",,"http://www.sciencedirect.com/science/book/9781597495967"
"9780123847119","Quantum Magnetic Resonance Imaging Diagnostics of Human Brain Disorders",2010,,,"Elsevier",,"http://www.sciencedirect.com/science/book/9780123847119"
"9780123814142","System Assurance",2011,,"The MK/OMG Press","Morgan Kaufmann",,"http://www.sciencedirect.com/science/book/9780123814142"
"9780080968025","Airworthiness (Second Edition)",2011,,,"Butterworth-Heinemann",,"http://www.sciencedirect.com/science/book/9780080968025"
"9780123749659","Optically Amplified WDM Networks",2011,,,"Academic Press",,"http://www.sciencedirect.com/science/book/9780123749659"
"9781856177047","VHDL 101",2011,,,"Newnes",,"http://www.sciencedirect.com/science/book/9781856177047"
"9780123849137","Neuroinflammation",2011,,,"Elsevier",,"http://www.sciencedirect.com/science/book/9780123849137"
"9780750675161","Neuro-Oncology",2010,"1877-184X","Blue Books of Neurology","Butterworth-Heinemann",,"http://www.sciencedirect.com/science/book/9780750675161"
"9780123743879","Obesity Prevention",2010,,,"Academic Press",,"http://www.sciencedirect.com/science/book/9780123743879"
"9780123747181","Irradiation of Food Commodities",2010,,,"Academic Press",,"http://www.sciencedirect.com/science/book/9780123747181"
"9780123747532","Hyperspectral Imaging for Food Quality Analysis and Control",2010,,,"Academic Press",,"http://www.sciencedirect.com/science/book/9780123747532"
"9780123748812","The Science of Grapevines",2010,,,"Academic Press",,"http://www.sciencedirect.com/science/book/9780123748812"
"9780123749383","Bioactive Foods in Promoting Health",2010,,,"Academic Press",,"http://www.sciencedirect.com/science/book/9780123749383"
"9780123750891","Environmental Biotechnology",2010,,,"Academic Press",,"http://www.sciencedirect.com/science/book/9780123750891"
"9780080548203","Environanotechnology",2010,,,"Elsevier",,"http://www.sciencedirect.com/science/book/9780080548203"
"9780123815415","No Code Required",2010,,,"Morgan Kaufmann",,"http://www.sciencedirect.com/science/book/9780123815415"
"9781597495578","Virtualization and Forensics",2010,,,"Syngress",,"http://www.sciencedirect.com/science/book/9781597495578"
"9781597495615","Microsoft Windows 7 Administrator's Reference",2010,,,"Syngress",,"http://www.sciencedirect.com/science/book/9781597495615"
"9780444532602","Small-Format Aerial Photography",2010,,,"Elsevier",,"http://www.sciencedirect.com/science/book/9780444532602"
"9780123815439","Electrical Load Forecasting",2010,,,"Butterworth-Heinemann",,"http://www.sciencedirect.com/science/book/9780123815439"
"9780123747266","Handbook of Blind Source Separation",2010,,,"Academic Press",,"http://www.sciencedirect.com/science/book/9780123747266"
"9780123747747","Solar Cell Device Physics (Second Edition)",2010,,,"Academic Press",,"http://www.sciencedirect.com/science/book/9780123747747"
"9780123749888","Biomass Gasification and Pyrolysis",2010,,,"Academic Press",,"http://www.sciencedirect.com/science/book/9780123749888"
"9781437778052","Process Risk and Reliability Management",2010,,,"William Andrew Publishing",,"http://www.sciencedirect.com/science/book/9781437778052"
"9781437778236","Semiconductor Nanomaterials for Flexible Technologies",2010,,"Micro and Nano Technologies","William Andrew Publishing",,"http://www.sciencedirect.com/science/book/9781437778236"
"9781856176781","Digital Media Processing",2010,,,"Newnes",,"http://www.sciencedirect.com/science/book/9781856176781"
"9780123786050","Introduction to WinBUGS for Ecologists",2010,,,"Academic Press",,"http://www.sciencedirect.com/science/book/9780123786050"
"9780123744302","Genetic Diagnosis of Endocrine Disorders",2010,,,"Academic Press",,"http://www.sciencedirect.com/science/book/9780123744302"
"9780123745187","Human Factors in Aviation (Second Edition)",2010,,,"Academic Press",,"http://www.sciencedirect.com/science/book/9780123745187"
"9780123749277","Nutritional and Herbal Therapies for Children and Adolescents",2010,,,"Academic Press",,"http://www.sciencedirect.com/science/book/9780123749277"
"9780123750358","WAIS-IV Clinical Use and Interpretation",2010,,,"Academic Press",,"http://www.sciencedirect.com/science/book/9780123750358"
"9780123745934","Handbook of Mammalian Vocalization",2010,"1569-7339","Handbook of Behavioral Neuroscience","Elsevier",,"http://www.sciencedirect.com/science/book/9780123745934"
"9780123814227","Principles of Regenerative Medicine (Second Edition)",2011,,,"Academic Press",,"http://www.sciencedirect.com/science/book/9780123814227"
"9780080966823","The MBR Book (Second Edition)",2011,,,"Butterworth-Heinemann",,"http://www.sciencedirect.com/science/book/9780080966823"
"9780444535887","Proceedings of the 2nd Annual Gas Processing Symposium",2010,,,"Elsevier",,"http://www.sciencedirect.com/science/book/9780444535887"
"9780815520412","The Refinery of the Future",2010,,,"William Andrew Publishing",,"http://www.sciencedirect.com/science/book/9780815520412"
"9780123814968","Understanding Motion Capture for Computer Animation (Second Edition)",2011,,"The Morgan Kaufmann Series in Computer Graphics","Morgan Kaufmann",,"http://www.sciencedirect.com/science/book/9780123814968"
"9780123819727","Entity Resolution and Information Quality",2011,,,"Morgan Kaufmann",,"http://www.sciencedirect.com/science/book/9780123819727"
"9780123750259","Renewable Energy (Fourth Edition)",2010,,,"Academic Press",,"http://www.sciencedirect.com/science/book/9780123750259"
"9781437778250","Handbook of Pollution Prevention and Cleaner Production: Best Practices in the Agrochemical Industry",2010,,,"William Andrew Publishing",,"http://www.sciencedirect.com/science/book/9781437778250"
"9781437778571","Handbook of Fire and Explosion Protection Engineering Principles",2011,,,"William Andrew Publishing",,"http://www.sciencedirect.com/science/book/9781437778571"
"9781856176897","Subsea Engineering Handbook",2010,,,"Gulf Professional Publishing",,"http://www.sciencedirect.com/science/book/9781856176897"
"9780123849113","Neurological Disorders and Pregnancy",2011,,,"Elsevier",,"http://www.sciencedirect.com/science/book/9780123849113"
"9780123785961","Online Counseling (Second Edition)",2011,,,"Academic Press",,"http://www.sciencedirect.com/science/book/9780123785961"
"9780123750914","Radiometric Temperature Measurements: II. Applications",2010,"1079-4042","Experimental Methods in the Physical Sciences","Academic Press",,"http://www.sciencedirect.com/science/book/9780123750914"
"9780444534408","Nanoclusters",2010,"1875-4023","Science and Technology of Atomic, Molecular, Condensed Matter & Biological Systems","Elsevier",,"http://www.sciencedirect.com/science/book/9780444534408"
"9780123751584","Fenner's Veterinary Virology (Fourth Edition)",2011,,,"Academic Press",,"http://www.sciencedirect.com/science/book/9780123751584"
"9780444535993","Modern Inorganic Synthetic Chemistry",2011,,,"Elsevier",,"http://www.sciencedirect.com/science/book/9780444535993"
"9781597495660","Eleventh Hour CISSP",2011,,,"Syngress",,"http://www.sciencedirect.com/science/book/9781597495660"
"9780080967813","Safety Critical Systems Handbook",2011,,,"Butterworth-Heinemann",,"http://www.sciencedirect.com/science/book/9780080967813"
"9780123749642","Mobile WiMAX",2011,,,"Academic Press",,"http://www.sciencedirect.com/science/book/9780123749642"
"9780123820983","Rotating Flow",2011,,,"Butterworth-Heinemann",,"http://www.sciencedirect.com/science/book/9780123820983"
"9780123821904","Autonomic Network Management Principles",2011,,,"Academic Press",,"http://www.sciencedirect.com/science/book/9780123821904"
"9780123821942","MIMO",2011,,,"Academic Press",,"http://www.sciencedirect.com/science/book/9780123821942"
"9781437778403","Microsystems for Bioelectronics",2011,,,"William Andrew Publishing",,"http://www.sciencedirect.com/science/book/9781437778403"
"9781856179430","Oil Spill Science and Technology",2011,,,"Gulf Professional Publishing",,"http://www.sciencedirect.com/science/book/9781856179430"
"9780123809261","The Pituitary (Third Edition)",2011,,,"Academic Press",,"http://www.sciencedirect.com/science/book/9780123809261"
"9780123748775","Plasma Scattering of Electromagnetic Radiation (Second Edition)",2011,,,"Academic Press",,"http://www.sciencedirect.com/science/book/9780123748775"
"9780123808806","Handbook of Aging and the Social Sciences (Seventh Edition)",2011,,"Handbooks of Aging","Academic Press",,"http://www.sciencedirect.com/science/book/9780123808806"
"9780123815224","Behavioral Treatments for Sleep Disorders",2011,,,"Academic Press",,"http://www.sciencedirect.com/science/book/9780123815224"
