"id","titulo","ano","issn","titulo_serie","editora","autor","url"
"9781845696993","Advances in Military Textiles and Personal Equipment",2012,,"Woodhead Publishing Series in Textiles","Woodhead Publishing",,"http://www.sciencedirect.com/science/book/9781845696993"
"9781845698003","Minimized Cardiopulmonary Bypass Techniques and Technologies",2012,,"Woodhead Publishing Series in Biomaterials","Woodhead Publishing",,"http://www.sciencedirect.com/science/book/9781845698003"
"9781845698027","Optical Biomimetics",2012,,"Woodhead Publishing Series in Electronic and Optical Materials","Woodhead Publishing",,"http://www.sciencedirect.com/science/book/9781845698027"
"9781845699307","Woven Textiles",2012,,"Woodhead Publishing Series in Textiles","Woodhead Publishing",,"http://www.sciencedirect.com/science/book/9781845699307"
"9781845699352","Biosensors for Medical Applications",2012,,"Woodhead Publishing Series in Biomaterials","Woodhead Publishing",,"http://www.sciencedirect.com/science/book/9781845699352"
"9781845699369","Laser Growth and Processing of Photonic Devices",2012,,"Woodhead Publishing Series in Electronic and Optical Materials","Woodhead Publishing",,"http://www.sciencedirect.com/science/book/9781845699369"
"9781845699390","The Global Textile and Clothing Industry",2012,,"Woodhead Publishing Series in Textiles","Woodhead Publishing",,"http://www.sciencedirect.com/science/book/9781845699390"
"9781845699499","Corrosion Protection and Control Using Nanomaterials",2012,,"Woodhead Publishing Series in Metals and Surface Engineering","Woodhead Publishing",,"http://www.sciencedirect.com/science/book/9781845699499"
"9781845699680","Advances in Wrought Magnesium Alloys",2012,,"Woodhead Publishing Series in Metals and Surface Engineering","Woodhead Publishing",,"http://www.sciencedirect.com/science/book/9781845699680"
"9781845699703","Phase Transformations in Steels: Fundamentals and Diffusion-Controlled Transformations",2012,,"Woodhead Publishing Series in Metals and Surface Engineering","Woodhead Publishing",,"http://www.sciencedirect.com/science/book/9781845699703"
"9781845699710","Phase Transformations in Steels: Diffusionless Transformations High Strength Steels Modelling and Advanced Analytical Techniques",2012,,"Woodhead Publishing Series in Metals and Surface Engineering","Woodhead Publishing",,"http://www.sciencedirect.com/science/book/9781845699710"
"9781845699727","Colour Design",2012,,"Woodhead Publishing Series in Textiles","Woodhead Publishing",,"http://www.sciencedirect.com/science/book/9781845699727"
"9781845699826","Leveraging Information Technology for Optimal Aircraft Maintenance, Repair and Overhaul (MRO)",2012,,"Woodhead Publishing Series in Biomedicine","Woodhead Publishing",,"http://www.sciencedirect.com/science/book/9781845699826"
"9781845699840","Progenitor and Stem Cell Technologies and Therapies",2012,,"Woodhead Publishing Series in Biomaterials","Woodhead Publishing",,"http://www.sciencedirect.com/science/book/9781845699840"
"9781845699895","Ultrasonic Transducers",2012,,"Woodhead Publishing Series in Electronic and Optical Materials","Woodhead Publishing",,"http://www.sciencedirect.com/science/book/9781845699895"
"9781845699918","Advances in Science and Technology of Mn+1AXn Phases",2012,,"Woodhead Publishing Series in Biomedicine","Woodhead Publishing",,"http://www.sciencedirect.com/science/book/9781845699918"
"9781845699963","Spacecraft Thermal Control",2012,,"Woodhead Publishing Series in Composites Science and Engineering","Woodhead Publishing",,"http://www.sciencedirect.com/science/book/9781845699963"
"9781907568725","The Design and Manufacture of Medical Devices",2012,,"Woodhead Publishing Reviews: Mechanical Engineering Series","Woodhead Publishing",,"http://www.sciencedirect.com/science/book/9781907568725"
"9780857090171","Biomaterials and Medical Tribology",2012,,"Woodhead Publishing Series in Biomaterials","Woodhead Publishing",,"http://www.sciencedirect.com/science/book/9780857090171"
"9780857090300","Machining Technology for Composite Materials",2012,,"Woodhead Publishing Series in Composites Science and Engineering","Woodhead Publishing",,"http://www.sciencedirect.com/science/book/9780857090300"
"9780857090690","Functional Nanofibers and their Applications",2012,,"Woodhead Publishing Series in Textiles","Woodhead Publishing",,"http://www.sciencedirect.com/science/book/9780857090690"
"9780857090706","Biocompatibility and Performance of Medical Devices",2012,,"Woodhead Publishing Series in Biomaterials","Woodhead Publishing",,"http://www.sciencedirect.com/science/book/9780857090706"
"9780857090874","Understanding and Improving the Durability of Textiles",2012,,"Woodhead Publishing Series in Textiles","Woodhead Publishing",,"http://www.sciencedirect.com/science/book/9780857090874"
"9780857091512","Materials and Surface Engineering",2012,,"Woodhead Publishing Reviews: Mechanical Engineering Series","Woodhead Publishing",,"http://www.sciencedirect.com/science/book/9780857091512"
"9780857092069","Defect Structure in Nanomaterials",2012,,"Woodhead Publishing Series in Biomaterials","Woodhead Publishing",,"http://www.sciencedirect.com/science/book/9780857092069"
"9780857092335","Nanomedicine",2012,,"Woodhead Publishing Series in Biomaterials","Woodhead Publishing",,"http://www.sciencedirect.com/science/book/9780857092335"
"9780857097101","Vegetable Oil-Based Polymers",2012,,"Chandos Information Professional Series","Woodhead Publishing",,"http://www.sciencedirect.com/science/book/9780857097101"
"9781845695682","Coatings for Biomedical Applications",2012,,"Woodhead Publishing Series in Biomaterials","Woodhead Publishing",,"http://www.sciencedirect.com/science/book/9781845695682"
"9781845696979","Handbook of Natural Fibres: Types, Properties and Factors Affecting Breeding and Cultivation",2012,,"Woodhead Publishing Series in Textiles","Woodhead Publishing",,"http://www.sciencedirect.com/science/book/9781845696979"
"9781845696986","Handbook of Natural Fibres: Processing and Applications",2012,,"Woodhead Publishing Series in Textiles","Woodhead Publishing",,"http://www.sciencedirect.com/science/book/9781845696986"
"9781845697501","Failure Mechanisms in Polymer Matrix Composites",2012,,"Woodhead Publishing Series in Composites Science and Engineering","Woodhead Publishing",,"http://www.sciencedirect.com/science/book/9781845697501"
"9781845697990","Biomaterials in Plastic Surgery",2012,,"Woodhead Publishing Series in Biomaterials","Woodhead Publishing",,"http://www.sciencedirect.com/science/book/9781845697990"
"9781845699291","Durability and Reliability of Medical Polymers",2012,,"Woodhead Publishing Series in Biomaterials","Woodhead Publishing",,"http://www.sciencedirect.com/science/book/9781845699291"
"9781845699321","Sterilisation of Biomaterials and Medical Devices",2012,,"Woodhead Publishing Series in Biomaterials","Woodhead Publishing",,"http://www.sciencedirect.com/science/book/9781845699321"
"9781845699338","False Twist Textured Yarns",2012,,"Woodhead Publishing Series in Textiles","Woodhead Publishing",,"http://www.sciencedirect.com/science/book/9781845699338"
"9781845699406","Advances in Polymer Nanocomposites",2012,,"Woodhead Publishing Series in Composites Science and Engineering","Woodhead Publishing",,"http://www.sciencedirect.com/science/book/9781845699406"
"9781845699864","Biomaterials for Spinal Surgery",2012,,"Woodhead Publishing Series in Biomaterials","Woodhead Publishing",,"http://www.sciencedirect.com/science/book/9781845699864"
"9781845699888","Printed Films",2012,,"Woodhead Publishing Series in Electronic and Optical Materials","Woodhead Publishing",,"http://www.sciencedirect.com/science/book/9781845699888"
"9781855739468","Introduction to Aerospace Materials",2012,,,"Woodhead Publishing",,"http://www.sciencedirect.com/science/book/9781855739468"
"9781843342922","Indexing",2012,,"Chandos Information Professional Series","Chandos Publishing",,"http://www.sciencedirect.com/science/book/9781843342922"
"9781843343929","Finding Official British Information",2012,,"Chandos Information Professional Series","Chandos Publishing",,"http://www.sciencedirect.com/science/book/9781843343929"
"9781843345695","New Directions for Academic Liaison Librarians",2012,,"Chandos Information Professional Series","Chandos Publishing",,"http://www.sciencedirect.com/science/book/9781843345695"
"9781843345893","Prometheus Assessed?",2012,,"Woodhead Publishing Series in Welding and Other Joining Technologies","Chandos Publishing",,"http://www.sciencedirect.com/science/book/9781843345893"
"9781843346050","Multinational Corporation Subsidiaries in China",2012,,"Chandos Asian Studies Series","Chandos Publishing",,"http://www.sciencedirect.com/science/book/9781843346050"
"9781843346142","Prospects of Regional Economic Cooperation in South Asia",2012,,"Chandos Asian Studies Series","Chandos Publishing",,"http://www.sciencedirect.com/science/book/9781843346142"
"9781843346241","Management of Information Organizations",2012,,"Chandos Information Professional Series","Chandos Publishing",,"http://www.sciencedirect.com/science/book/9781843346241"
"9781843346258","Global Resource Sharing",2012,,"Chandos Information Professional Series","Chandos Publishing",,"http://www.sciencedirect.com/science/book/9781843346258"
"9781843346333","Universal Design",2012,,"Chandos Information Professional Series","Chandos Publishing",,"http://www.sciencedirect.com/science/book/9781843346333"
"9781843346340","Succeed or Sink",2012,,"Chandos Asian Studies Series","Chandos Publishing",,"http://www.sciencedirect.com/science/book/9781843346340"
"9781843346371","Records Management for Museums and Galleries",2012,,"Chandos Information Professional Series","Chandos Publishing",,"http://www.sciencedirect.com/science/book/9781843346371"
"9781843346388","Library Technology and User Services",2012,,"Chandos Information Professional Series","Chandos Publishing",,"http://www.sciencedirect.com/science/book/9781843346388"
"9781843346401","Engaging First-Year Students in Meaningful Library Research",2012,,"Chandos Information Professional Series","Chandos Publishing",,"http://www.sciencedirect.com/science/book/9781843346401"
"9781843346425","Libraries and Archives",2012,,"Chandos Information Professional Series","Chandos Publishing",,"http://www.sciencedirect.com/science/book/9781843346425"
"9781843346432","Instructional Strategies and Techniques for Information Professionals",2012,,"Chandos Information Professional Series","Chandos Publishing",,"http://www.sciencedirect.com/science/book/9781843346432"
"9781843346456","Enhancing Learning and Teaching Through Student Feedback in Engineering",2012,,"Chandos Learning and Teaching Series","Chandos Publishing",,"http://www.sciencedirect.com/science/book/9781843346456"
"9781843346470","Crisis Information Management",2012,,"Chandos Information Professional Series","Chandos Publishing",,"http://www.sciencedirect.com/science/book/9781843346470"
"9781843346487","Internet Law in China",2012,,"Chandos Asian Studies Series","Chandos Publishing",,"http://www.sciencedirect.com/science/book/9781843346487"
"9781843346517","Building Your Library Career with Web 2.0",2012,,"Chandos Information Professional Series","Chandos Publishing",,"http://www.sciencedirect.com/science/book/9781843346517"
"9781843346531","Records Management and Knowledge Mobilisation",2012,,"Chandos Information Professional Series","Chandos Publishing",,"http://www.sciencedirect.com/science/book/9781843346531"
"9781843346579","HR Due Diligence",2012,,"Chandos Asian Studies Series","Chandos Publishing",,"http://www.sciencedirect.com/science/book/9781843346579"
"9781843346586","Leadership in Libraries",2012,,"Chandos Information Professional Series","Chandos Publishing",,"http://www.sciencedirect.com/science/book/9781843346586"
"9781843346609","Library Classification Trends in the 21st Century",2012,,"Chandos Information Professional Series","Chandos Publishing",,"http://www.sciencedirect.com/science/book/9781843346609"
"9781843346616","Strategic Business Development for Information Centres and Libraries",2012,,"Chandos Information Professional Series","Chandos Publishing",,"http://www.sciencedirect.com/science/book/9781843346616"
"9781843346678","Social Information",2012,,"Chandos Publishing Social Media Series","Chandos Publishing",,"http://www.sciencedirect.com/science/book/9781843346678"
"9781843346685","Electronic Resource Management",2012,,"Chandos Information Professional Series","Chandos Publishing",,"http://www.sciencedirect.com/science/book/9781843346685"
"9781843346692","Academic and Professional Publishing",2012,,"Chandos Information Professional Series","Chandos Publishing",,"http://www.sciencedirect.com/science/book/9781843346692"
"9781843346708","Not Your Ordinary Librarian",2012,,"Chandos Information Professional Series","Chandos Publishing",,"http://www.sciencedirect.com/science/book/9781843346708"
"9781843346722","Data Clean-Up and Management",2012,,"Chandos Information Professional Series","Chandos Publishing",,"http://www.sciencedirect.com/science/book/9781843346722"
"9781843346746","Teaching Research Processes",2012,,"Chandos Information Professional Series","Chandos Publishing",,"http://www.sciencedirect.com/science/book/9781843346746"
"9781843346777","Google This!",2012,,"Chandos Information Professional Series","Chandos Publishing",,"http://www.sciencedirect.com/science/book/9781843346777"
"9781843346784","Managing Intellectual Capital in Libraries",2012,,"Chandos Information Professional Series","Chandos Publishing",,"http://www.sciencedirect.com/science/book/9781843346784"
"9781843346791","Public Libraries and their National Policies",2012,,"Chandos Information Professional Series","Chandos Publishing",,"http://www.sciencedirect.com/science/book/9781843346791"
"9781843346807","Ways of Experiencing Information Literacy",2012,,"Chandos Information Professional Series","Chandos Publishing",,"http://www.sciencedirect.com/science/book/9781843346807"
"9781843346814","Social Media for Academics",2012,,"Chandos Publishing Social Media Series","Chandos Publishing",,"http://www.sciencedirect.com/science/book/9781843346814"
"9781843346838","Information Services and Digital Literacy",2012,,"Chandos Information Professional Series","Chandos Publishing",,"http://www.sciencedirect.com/science/book/9781843346838"
"9781843346845","Meeting the Needs of Student Users in Academic Libraries",2012,,"Chandos Information Professional Series","Chandos Publishing",,"http://www.sciencedirect.com/science/book/9781843346845"
"9781843346869","An Evaluation of the Benefits and Value of Libraries",2012,,"Chandos Information Professional Series","Chandos Publishing",,"http://www.sciencedirect.com/science/book/9781843346869"
"9781843346883","Designing Effective Library Tutorials",2012,,"Chandos Learning and Teaching Series","Chandos Publishing",,"http://www.sciencedirect.com/science/book/9781843346883"
"9781843346890","Ethical Behaviour in the E-Classroom",2012,,"Chandos Learning and Teaching Series","Chandos Publishing",,"http://www.sciencedirect.com/science/book/9781843346890"
"9781843346937","Public Interest and Private Rights in Social Media",2012,,"Chandos Publishing Social Media Series","Chandos Publishing",,"http://www.sciencedirect.com/science/book/9781843346937"
"9781843346951","Digital Dialogues and Community 2.0",2012,,"Chandos Publishing Social Media Series","Chandos Publishing",,"http://www.sciencedirect.com/science/book/9781843346951"
"9781843347002","Personal Knowledge Capital",2012,,"Chandos Information Professional Series","Chandos Publishing",,"http://www.sciencedirect.com/science/book/9781843347002"
"9781843347095","From Science 2.0 to Pharma 3.0",2012,,"Chandos Publishing Social Media Series","Chandos Publishing",,"http://www.sciencedirect.com/science/book/9781843347095"
"9781843347118","Managing Social Media in Libraries",2012,,"Chandos Publishing Social Media Series","Chandos Publishing",,"http://www.sciencedirect.com/science/book/9781843347118"
"9781843347125","Archives and Societal Provenance",2012,,"Chandos Information Professional Series","Chandos Publishing",,"http://www.sciencedirect.com/science/book/9781843347125"
"9780124158368","Bacterial Biogeochemistry (Third Edition)",2012,,,"Academic Press",,"http://www.sciencedirect.com/science/book/9780124158368"
"9780123848642","Statistics in Medicine (Third Edition)",2012,,,"Academic Press",,"http://www.sciencedirect.com/science/book/9780123848642"
"9780123848697","Observing the User Experience (Second Edition)",2012,,,"Morgan Kaufmann",,"http://www.sciencedirect.com/science/book/9780123848697"
"9780124158290","Data Governance",2012,,,"Morgan Kaufmann",,"http://www.sciencedirect.com/science/book/9780124158290"
"9781597499637","SQL Injection Attacks and Defense (Second Edition)",2012,,,"Syngress",,"http://www.sciencedirect.com/science/book/9781597499637"
"9780444594259","The Geologic Time Scale",2012,,,"Elsevier",,"http://www.sciencedirect.com/science/book/9780444594259"
"9780080977683","Fast and Effective Embedded Systems Design",2012,,,"Newnes",,"http://www.sciencedirect.com/science/book/9780080977683"
"9780123851284","Handbook of Green Building Design and Construction",2012,,,"Butterworth-Heinemann",,"http://www.sciencedirect.com/science/book/9780123851284"
"9780123854759","Offshore Structures",2012,,,"Gulf Professional Publishing",,"http://www.sciencedirect.com/science/book/9780123854759"
"9781437778731","Handbook of Thin Film Deposition (Third Edition)",2012,,,"William Andrew Publishing",,"http://www.sciencedirect.com/science/book/9781437778731"
"9780124158955","Taxonomic Guide to Infectious Diseases",2012,,,"Academic Press",,"http://www.sciencedirect.com/science/book/9780124158955"
"9780123858726","Cellular Imaging Techniques for Neuroscience and Beyond",2012,,,"Academic Press",,"http://www.sciencedirect.com/science/book/9780123858726"
"9780123869654","Fluid Catalytic Cracking Handbook (Third Edition)",2012,,,"Butterworth-Heinemann",,"http://www.sciencedirect.com/science/book/9780123869654"
"9780124160361","Polyphosphoesters",2012,,,"Elsevier",,"http://www.sciencedirect.com/science/book/9780124160361"
"9780123851307","It's Our Research",2012,,,"Morgan Kaufmann",,"http://www.sciencedirect.com/science/book/9780123851307"
"9780123877338","Joe Celko's Trees and Hierarchies in SQL for Smarties (Second Edition)",2012,,"The Morgan Kaufmann Series in Data Management Systems","Morgan Kaufmann",,"http://www.sciencedirect.com/science/book/9780123877338"
"9780124158153","Handbook on Securing Cyber-Physical Critical Infrastructure",2012,,,"Morgan Kaufmann",,"http://www.sciencedirect.com/science/book/9780124158153"
"9780123851345","Electricity Marginal Cost Pricing",2012,,,"Butterworth-Heinemann",,"http://www.sciencedirect.com/science/book/9780123851345"
"9780124158412","Construction Hazardous Materials Compliance Guide: Asbestos Detection, Abatement, and Inspection Procedures",2012,,,"Butterworth-Heinemann",,"http://www.sciencedirect.com/science/book/9780124158412"
"9780123852465","Handbook of Loss Prevention and Crime Prevention  (Fifth Edition)",2012,,,"Butterworth-Heinemann",,"http://www.sciencedirect.com/science/book/9780123852465"
"9780123869838","Introduction to Robust Estimation and Hypothesis Testing (Third Edition)",2013,,"Statistical Modeling and Decision Science","Academic Press",,"http://www.sciencedirect.com/science/book/9780123869838"
"9780123877604","Statistics for Physical Sciences",2012,,,"Academic Press",,"http://www.sciencedirect.com/science/book/9780123877604"
"9780444563576","Regional Geology and Tectonics: Phanerozoic Passive Margins, Cratonic Basins and Global Tectonic Maps",2012,,,"Elsevier",,"http://www.sciencedirect.com/science/book/9780444563576"
"9780123914040","The Hands-on XBEE Lab Manual",2013,,,"Newnes",,"http://www.sciencedirect.com/science/book/9780123914040"
"9780123878298","Genetics of Bone Biology and Skeletal Disease",2013,,,"Academic Press",,"http://www.sciencedirect.com/science/book/9780123878298"
"9780123964632","Agile Data Warehousing Project Management",2013,,,"Morgan Kaufmann",,"http://www.sciencedirect.com/science/book/9780123964632"
"9780123972194","Fundamentals of Renewable Energy Processes (Third Edition)",2013,,,"Academic Press",,"http://www.sciencedirect.com/science/book/9780123972194"
"9781437734676","Tribology of Abrasive Machining Processes (Second Edition)",2013,,,"William Andrew Publishing",,"http://www.sciencedirect.com/science/book/9781437734676"
"9780123919243","The Neuroscience of Autism Spectrum Disorders",2013,,,"Academic Press",,"http://www.sciencedirect.com/science/book/9780123919243"
"9780123984982","How the Great Scientists Reasoned",2013,,,"Elsevier",,"http://www.sciencedirect.com/science/book/9780123984982"
"9780124160491","Ethics for Graduate Researchers",2013,,,"Elsevier",,"http://www.sciencedirect.com/science/book/9780124160491"
"9780122423529","Biochemistry of Foods (Third Edition)",2013,,,"Academic Press",,"http://www.sciencedirect.com/science/book/9780122423529"
"9780123849373","Tea in Health and Disease Prevention",2013,,,"Academic Press",,"http://www.sciencedirect.com/science/book/9780123849373"
"9780123964854","Bioactive Food as Dietary Interventions for Cardiovascular Disease",2013,,,"Academic Press",,"http://www.sciencedirect.com/science/book/9780123964854"
"9780123971531","Bioactive Food as Dietary Interventions for Diabetes",2013,,,"Academic Press",,"http://www.sciencedirect.com/science/book/9780123971531"
"9780123971548","Bioactive Food as Dietary Interventions for Liver and Gastrointestinal Disease",2013,,,"Academic Press",,"http://www.sciencedirect.com/science/book/9780123971548"
"9780123971555","Bioactive Food as Dietary Interventions for the Aging Population",2013,,,"Academic Press",,"http://www.sciencedirect.com/science/book/9780123971555"
"9780123971562","Bioactive Food as Dietary Interventions for Arthritis and Related Inflammatory Diseases",2013,,,"Academic Press",,"http://www.sciencedirect.com/science/book/9780123971562"
"9780123878373","Platelets (Third Edition)",2013,,,"Academic Press",,"http://www.sciencedirect.com/science/book/9780123878373"
"9780123821614","Purification of Laboratory Chemicals (Seventh Edition)",2013,,,"Butterworth-Heinemann",,"http://www.sciencedirect.com/science/book/9780123821614"
"9780124158924","Effective Physical Security (Fourth Edition)",2013,,,"Butterworth-Heinemann",,"http://www.sciencedirect.com/science/book/9780124158924"
"9780124159334","CUDA Programming",2013,,"Applications of GPU Computing Series","Morgan Kaufmann",,"http://www.sciencedirect.com/science/book/9780124159334"
"9781597499620","Network Intrusion Analysis",2013,,,"Syngress",,"http://www.sciencedirect.com/science/book/9781597499620"
"9780123971784","Distributed Renewable Energies for Off-Grid Communities",2013,,,"Elsevier",,"http://www.sciencedirect.com/science/book/9780123971784"
"9780080982427","Flight Dynamics Principles (Third Edition)",2013,,,"Butterworth-Heinemann",,"http://www.sciencedirect.com/science/book/9780080982427"
"9780123945952","EPC and 4G Packet Networks (Second Edition)",2013,,,"Academic Press",,"http://www.sciencedirect.com/science/book/9780123945952"
"9780123970350","Micromechanics of Composite Materials",2013,,,"Butterworth-Heinemann",,"http://www.sciencedirect.com/science/book/9780123970350"
"9780124158719","Biomedical Optical Phase Microscopy and Nanoscopy",2012,,,"Academic Press",,"http://www.sciencedirect.com/science/book/9780124158719"
"9781455778980","Thermoplastics and Thermoplastic Composites (Second Edition)",2013,,"Plastics Design Library","William Andrew Publishing",,"http://www.sciencedirect.com/science/book/9781455778980"
"9780123970268","Unraveling Environmental Disasters",2013,,,"Elsevier",,"http://www.sciencedirect.com/science/book/9780123970268"
"9780444529374","Logic: A History of its Central Concepts",2012,"1874-5857","Handbook of the History of Logic","North-Holland",,"http://www.sciencedirect.com/science/book/9780444529374"
"9780123860071","Clinical Pharmacology During Pregnancy",2013,,,"Academic Press",,"http://www.sciencedirect.com/science/book/9780123860071"
"9780123878151","A Comprehensive Guide to Toxicology in Preclinical Drug Development",2013,,,"Academic Press",,"http://www.sciencedirect.com/science/book/9780123878151"
"9780123983718","Lead Compounds from Medicinal Plants for the Treatment of Cancer",2013,,,"Academic Press",,"http://www.sciencedirect.com/science/book/9780123983718"
"9780123984555","Problem Solving Therapy in the Clinical Practice",2013,,,"Elsevier",,"http://www.sciencedirect.com/science/book/9780123984555"
"9780123819802","The Vitamins (Fourth Edition)",2012,,,"Academic Press",,"http://www.sciencedirect.com/science/book/9780123819802"
"9780123813657","Nonhuman Primates in Biomedical Research (Second Edition), Volume 1",2012,,"S033/American College of Laboratory Animal Medicine","Academic Press",,"http://www.sciencedirect.com/science/book/9780123813657"
"9780123813664","Nonhuman Primates in Biomedical Research (Second Edition), Volume 2",2012,,"S033/American College of Laboratory Animal Medicine","Academic Press",,"http://www.sciencedirect.com/science/book/9780123813664"
"9780124160385","Dento/Oro/Craniofacial Anomalies and Genetics",2012,,,"Elsevier",,"http://www.sciencedirect.com/science/book/9780124160385"
"9780123859464","Grounded Innovation",2012,,,"Morgan Kaufmann",,"http://www.sciencedirect.com/science/book/9780123859464"
"9780123865335","Switching Power Supplies A - Z (Second Edition)",2012,,,"Newnes",,"http://www.sciencedirect.com/science/book/9780123865335"
"9780123869081","Computer and Machine Vision (Fourth Edition)",2012,,,"Academic Press",,"http://www.sciencedirect.com/science/book/9780123869081"
"9781455778911","Microbiorobotics",2012,,,"William Andrew Publishing",,"http://www.sciencedirect.com/science/book/9781455778911"
