"id","titulo","ano","issn","titulo_serie","editora","autor","url"
"9780123748379","An Introduction to Trading in the Financial Markets: Global Markets, Risk, Compliance, and Regulation",2012,,,"Academic Press",,"http://www.sciencedirect.com/science/book/9780123748379"
"9780123849250","Encyclopedia of Body Image and Human Appearance",2012,,,"Academic Press",,"http://www.sciencedirect.com/science/book/9780123849250"
"9780123815101","Muscle",2012,,,"Academic Press",,"http://www.sciencedirect.com/science/book/9780123815101"
"9780124159938","Structured Parallel Programming",2012,,,"Morgan Kaufmann",,"http://www.sciencedirect.com/science/book/9780124159938"
"9780123869142","Handbook of Natural Gas Transmission and Processing (Second Edition)",2012,,,"Gulf Professional Publishing",,"http://www.sciencedirect.com/science/book/9780123869142"
"9780080982410","Turbulence in Porous Media (Second Edition)",2012,,,"Elsevier",,"http://www.sciencedirect.com/science/book/9780080982410"
"9780123821690","Introduction to Forensic Psychology (Third Edition)",2012,,,"Academic Press",,"http://www.sciencedirect.com/science/book/9780123821690"
"9780123868978","Managing Agricultural Greenhouse Gases",2012,,,"Academic Press",,"http://www.sciencedirect.com/science/book/9780123868978"
"9780124160071","Cargo Theft, Loss Prevention, and Supply Chain Security",2013,,,"Butterworth-Heinemann",,"http://www.sciencedirect.com/science/book/9780124160071"
"9780080977812","Adiabatic Shear Localization (Second Edition)",2012,,,"Elsevier",,"http://www.sciencedirect.com/science/book/9780080977812"
"9780123814517","Molecular Medicine (Fourth Edition)",2012,,,"Academic Press",,"http://www.sciencedirect.com/science/book/9780123814517"
"9780323074193","Clinical Gynecologic Oncology (Eighth Edition)",2012,,,"Mosby",,"http://www.sciencedirect.com/science/book/9780323074193"
"9780323079099","Minor Emergencies (Third Edition)",2012,,,"W.B. Saunders",,"http://www.sciencedirect.com/science/book/9780323079099"
"9780702042690","Contact Lens Complications (Third Edition)",2012,,,"W.B. Saunders",,"http://www.sciencedirect.com/science/book/9780702042690"
"9781437727876","Anesthesia and Uncommon Diseases (Sixth Edition)",2012,,,"W.B. Saunders",,"http://www.sciencedirect.com/science/book/9781437727876"
"9781455712748","Clinical Arrhythmology and Electrophysiology: A Companion to Braunwald's Heart Disease (Second Edition)",2012,,,"W.B. Saunders",,"http://www.sciencedirect.com/science/book/9781455712748"
"9780323067676","Mosby's Field Guide to Occupational Therapy for Physical Dysfunction",2013,,,"Mosby",,"http://www.sciencedirect.com/science/book/9780323067676"
"9780443068157","Clinical Application of Neuromuscular Techniques (Second Edition)",2012,,,"Churchill Livingstone",,"http://www.sciencedirect.com/science/book/9780443068157"
"9780702034732","Managing Sports Injuries (Fourth Edition)",2011,,,"Churchill Livingstone",,"http://www.sciencedirect.com/science/book/9780702034732"
"9780702043512","Visceral Vascular Manipulations",2012,,,"Churchill Livingstone",,"http://www.sciencedirect.com/science/book/9780702043512"
"9780702046186","Oral and Maxillofacial Surgery in Dogs and Cats",2012,,,"W.B. Saunders",,"http://www.sciencedirect.com/science/book/9780702046186"
"9781416036616","Canine and Feline Gastroenterology",2013,,,"W.B. Saunders",,"http://www.sciencedirect.com/science/book/9781416036616"
"9780123865403","{Strategies and Tactics in Organic Synthesis, Volume 8}",2012,"1874-6004","Strategies and Tactics in Organic Synthesis","Academic Press",,"http://www.sciencedirect.com/science/book/9780123865403"
"9780080450162","Tropical Radioecology",2012,"1569-4860","Radioactivity in the Environment","Elsevier",,"http://www.sciencedirect.com/science/book/9780080450162"
"9780080451589","Fractal Models in Exploration Geophysics",2012,"0950-1401","Handbook of Geophysical Exploration: Seismic Exploration","Pergamon",,"http://www.sciencedirect.com/science/book/9780080451589"
"9780123849847","Insect Pathology (Second Edition)",2012,,,"Academic Press",,"http://www.sciencedirect.com/science/book/9780123849847"
"9780123850836","Nutritional and Therapeutic Interventions for Diabetes and Metabolic Syndrome",2012,,,"Academic Press",,"http://www.sciencedirect.com/science/book/9780123850836"
"9781890661403","Organic Synthesis (Third Edition)",2010,,,"Academic Press",,"http://www.sciencedirect.com/science/book/9781890661403"
"9780123847171","Tcl/Tk (Third Edition)",2012,,"The Morgan Kaufmann Series in Software Engineering and Programming","Morgan Kaufmann",,"http://www.sciencedirect.com/science/book/9780123847171"
"9780123919267","Digital Video and HD (Second Edition)",2012,,"The Morgan Kaufmann Series in Computer Graphics","Morgan Kaufmann",,"http://www.sciencedirect.com/science/book/9780123919267"
"9780123970107","Temporal QOS Management in Scientific Cloud Workflow Systems",2012,,,"Elsevier",,"http://www.sciencedirect.com/science/book/9780123970107"
"9780123851246","Managed Pressure Drilling: Modeling, Strategy and Planning",2012,,,"Gulf Professional Publishing",,"http://www.sciencedirect.com/science/book/9780123851246"
"9780123859266","Veterinary Toxicology (Second Edition)",2012,,,"Academic Press",,"http://www.sciencedirect.com/science/book/9780123859266"
"9781597499613","CISSP Study Guide (Second Edition)",2012,,,"Syngress",,"http://www.sciencedirect.com/science/book/9781597499613"
"9780123943910","Digital Control Engineering (Second Edition)",2013,,,"Academic Press",,"http://www.sciencedirect.com/science/book/9780123943910"
"9781437727869","Total Burn Care (Fourth Edition)",2012,,,"W.B. Saunders",,"http://www.sciencedirect.com/science/book/9781437727869"
"9780123852236","An Introduction to Atmospheric Gravity Waves",2012,"0074-6142","International Geophysics","Academic Press",,"http://www.sciencedirect.com/science/book/9780123852236"
"9780444521378","Spinal Cord Injury",2012,"0072-9752","Handbook of Clinical Neurology","Elsevier",,"http://www.sciencedirect.com/science/book/9780444521378"
"9780444563354","New Perspectives on Deep-water Sandstones",2012,"1567-8032","Handbook of Petroleum Exploration and Production","Elsevier",,"http://www.sciencedirect.com/science/book/9780444563354"
"9781416068396","Schmidek and Sweet Operative Neurosurgical Techniques (Sixth Edition)",2012,,,"W.B. Saunders",,"http://www.sciencedirect.com/science/book/9781416068396"
"9780444594310","22nd European Symposium on Computer Aided Process Engineering",2012,"1570-7946","Computer Aided Chemical Engineering","Elsevier",,"http://www.sciencedirect.com/science/book/9780444594310"
"9781597496353","Logging and Log Management",2013,,,"Syngress",,"http://www.sciencedirect.com/science/book/9781597496353"
"9781597497374","Federal Cloud Computing",2013,,,"Syngress",,"http://www.sciencedirect.com/science/book/9781597497374"
"9780124158443","Handbook of Green Information and Communication Systems",2013,,,"Academic Press",,"http://www.sciencedirect.com/science/book/9780124158443"
"9781455778812","Ionizing Radiation and Polymers",2013,,,"William Andrew Publishing",,"http://www.sciencedirect.com/science/book/9781455778812"
"9780123979322","The Pragmatic MBA for Scientific and Technical Executives",2013,,,"Academic Press",,"http://www.sciencedirect.com/science/book/9780123979322"
"9780123945938","Graphene",2013,,,"Elsevier",,"http://www.sciencedirect.com/science/book/9780123945938"
"9781416055952","Arthritis in Black and White (Third Edition)",2012,,,"W.B. Saunders",,"http://www.sciencedirect.com/science/book/9781416055952"
"9781437707014","Principles of Neurological Surgery (Third Edition)",2012,,,"W.B. Saunders",,"http://www.sciencedirect.com/science/book/9781437707014"
"9781437714548","Blumgart's Surgery of the Liver, Pancreas and Biliary Tract (Fifth Edition)",2012,,,"W.B. Saunders",,"http://www.sciencedirect.com/science/book/9781437714548"
"9781437726039","Gastroenterology and Nutrition: Neonatology Questions and Controversies (Second Edition)",2012,,,"W.B. Saunders",,"http://www.sciencedirect.com/science/book/9781437726039"
"9781437726589","Nephrology and Fluid/Electrolyte Physiology: Neonatology Questions and Controversies (Second Edition)",2012,,,"W.B. Saunders",,"http://www.sciencedirect.com/science/book/9781437726589"
"9781437726626","Hematology, Immunology and Infectious Disease: Neonatology Questions and Controversies (Second Edition)",2012,,,"W.B. Saunders",,"http://www.sciencedirect.com/science/book/9781437726626"
"9781437726824","The Newborn Lung: Neonatology Questions and Controversies (Second Edition)",2012,,,"W.B. Saunders",,"http://www.sciencedirect.com/science/book/9781437726824"
"9780444537843","Energy potential of the Russian Arctic Seas",2012,"0376-7361","Developments in Petroleum Science","Elsevier",,"http://www.sciencedirect.com/science/book/9780444537843"
"9780444516213","Sets and Extensions in the Twentieth Century",2012,"1874-5857","Handbook of the History of Logic","North-Holland",,"http://www.sciencedirect.com/science/book/9780444516213"
"9780444594976","The Thermodynamics of Phase and Reaction Equilibria",2013,,,"Elsevier",,"http://www.sciencedirect.com/science/book/9780444594976"
"9780124157606","Digital Video Processing for Engineers",2012,,,"Newnes",,"http://www.sciencedirect.com/science/book/9780124157606"
"9781437734652","Ultrananocrystalline Diamond (Second Edition)",2012,,"S543/Micro and Nano Technologies","William Andrew Publishing",,"http://www.sciencedirect.com/science/book/9781437734652"
"9780124159617","Rethinking Autism",2013,,,"Academic Press",,"http://www.sciencedirect.com/science/book/9780124159617"
"9780124160460","Neuropsychological Rehabilitation",2013,,,"Elsevier",,"http://www.sciencedirect.com/science/book/9780124160460"
"9780124160484","Telemental Health",2013,,,"Elsevier",,"http://www.sciencedirect.com/science/book/9780124160484"
"9780444533548","Formation and Properties of Clay-Polymer Complexes",2012,"1572-4352","Developments in Clay Science","Elsevier",,"http://www.sciencedirect.com/science/book/9780444533548"
"9780123854735","Human Stem Cell Manual (Second Edition)",2012,,,"Academic Press",,"http://www.sciencedirect.com/science/book/9780123854735"
"9780444595140","Studies in Natural Products Chemistry",2012,"1572-5995","Studies in Natural Products Chemistry","Elsevier",,"http://www.sciencedirect.com/science/book/9780444595140"
"9781597499477","Securing SQL Server (Second Edition)",2013,,,"Syngress",,"http://www.sciencedirect.com/science/book/9781597499477"
"9780444563347","Membrane Processes in Biotechnology and Pharmaceutics",2012,,,"Elsevier",,"http://www.sciencedirect.com/science/book/9780444563347"
"9780080966304","Organic Syntheses Based on Name Reactions (Third Edition)",2012,,,"Elsevier",,"http://www.sciencedirect.com/science/book/9780080966304"
"9780444537829","Biological Inorganic Chemistry (Second Edition)",2012,,,"Elsevier",,"http://www.sciencedirect.com/science/book/9780444537829"
"9780123914972","Sensors for Mechatronics",2012,,,"Elsevier",,"http://www.sciencedirect.com/science/book/9780123914972"
"9780750685252","Operational Amplifier Noise",2012,,,"Newnes",,"http://www.sciencedirect.com/science/book/9780750685252"
"9780123914934","Entropy Principle for the Development of Complex Biotic Systems",2012,,,"Elsevier",,"http://www.sciencedirect.com/science/book/9780123914934"
"9780123869791","Practical Text Mining and Statistical Analysis for Non-structured Text Data Applications",2012,,,"Academic Press",,"http://www.sciencedirect.com/science/book/9780123869791"
"9780444563255","Fuel Cells: Current Technology Challenges and Future Research Needs",2013,,,"Elsevier",,"http://www.sciencedirect.com/science/book/9780444563255"
"9780123969811","Designing the Search Experience",2013,,,"Morgan Kaufmann",,"http://www.sciencedirect.com/science/book/9780123969811"
"9781597497350","Information Security Risk Assessment Toolkit",2013,,,"Syngress",,"http://www.sciencedirect.com/science/book/9781597497350"
"9780123869647","Solar Cells (Second Edition)",2013,,,"Elsevier",,"http://www.sciencedirect.com/science/book/9780123869647"
"9780124045729","Oil Sand Production Processes",2013,,,"Gulf Professional Publishing",,"http://www.sciencedirect.com/science/book/9780124045729"
"9780080982854","Writing for Science and Engineering (Second Edition)",2013,,,"Elsevier",,"http://www.sciencedirect.com/science/book/9780080982854"
"9781437734836","Handbook of Sputter Deposition Technology (Second Edition)",2012,,,"William Andrew Publishing",,"http://www.sciencedirect.com/science/book/9781437734836"
"9780124046290","Evolution of Fossil Ecosystems (Second Edition)",2012,,,"Academic Press",,"http://www.sciencedirect.com/science/book/9780124046290"
"9780123978738","Handbook of Key Global Financial Markets, Institutions, and Infrastructure",2012,,,"Academic Press",,"http://www.sciencedirect.com/science/book/9780123978738"
"9780123978745","The Evidence and Impact of Financial Globalization",2012,,,"Academic Press",,"http://www.sciencedirect.com/science/book/9780123978745"
"9780123978752","Handbook of Safeguarding Global Financial Stability",2012,,,"Academic Press",,"http://www.sciencedirect.com/science/book/9780123978752"
"9780124158757","Rethinking Valuation and Pricing Models",2013,,,"Academic Press",,"http://www.sciencedirect.com/science/book/9780124158757"
"9780124158252","Simulation (Fifth Edition)",2013,,,"Academic Press",,"http://www.sciencedirect.com/science/book/9780124158252"
"9780124058866","Securing Safe Water Supplies",2013,,,"Academic Press",,"http://www.sciencedirect.com/science/book/9780124058866"
"9780123971906","Nothing but the Tooth",2013,,,"Elsevier",,"http://www.sciencedirect.com/science/book/9780123971906"
"9781597496414","FISMA and the Risk Management Framework",2013,,,"Syngress",,"http://www.sciencedirect.com/science/book/9781597496414"
"9781597497473","UTM Security with Fortinet",2013,,,"Syngress",,"http://www.sciencedirect.com/science/book/9781597497473"
"9781597499491","Advanced Persistent Threat",2013,,,"Syngress",,"http://www.sciencedirect.com/science/book/9781597499491"
"9781597499507","The Hacker's Guide to OS X",2013,,,"Syngress",,"http://www.sciencedirect.com/science/book/9781597499507"
"9781455731268","Surface Preparation Techniques for Adhesive Bonding (Second Edition)",2013,,,"William Andrew Publishing",,"http://www.sciencedirect.com/science/book/9781455731268"
"9780124071964","Sustainability Assessment",2013,,,"Academic Press",,"http://www.sciencedirect.com/science/book/9780124071964"
"9780124157699","Nanobiotechnology",2012,"1876-2778","Frontiers of Nanoscience","Elsevier",,"http://www.sciencedirect.com/science/book/9780124157699"
"9780444538574","Ultracold Bosonic and Fermionic Gases",2012,"1572-0934","Contemporary Concepts of Condensed Matter Science","Elsevier",,"http://www.sciencedirect.com/science/book/9780444538574"
"9780123848604","Regenerative Biology and Medicine (Second Edition)",2012,,,"Academic Press",,"http://www.sciencedirect.com/science/book/9780123848604"
"9780123820266","Physiology of the Gastrointestinal Tract (Fifth Edition)",2012,,,"Academic Press",,"http://www.sciencedirect.com/science/book/9780123820266"
"9780124160422","The Climate of the Mediterranean Region",2012,,,"Elsevier",,"http://www.sciencedirect.com/science/book/9780124160422"
"9780123971685","Underground Infrastructures",2012,,,"Butterworth-Heinemann",,"http://www.sciencedirect.com/science/book/9780123971685"
"9780444516763","Philosophy of Economics",2012,,"Handbook of the Philosophy of Science","North-Holland",,"http://www.sciencedirect.com/science/book/9780444516763"
"9780080968070","{Progress in Heterocyclic Chemistry, Volume 24}",2012,"0959-6380","Progress in Heterocyclic Chemistry","Elsevier",,"http://www.sciencedirect.com/science/book/9780080968070"
"9780444593894","Advances in Molecular Toxicology",2012,"1872-0854","Advances in Molecular Toxicology","Elsevier",,"http://www.sciencedirect.com/science/book/9780444593894"
"9780080977607","Alberta Oil Sands",2012,"1474-8177","Developments in Environmental Science","Elsevier",,"http://www.sciencedirect.com/science/book/9780080977607"
"9780123820082","The Laboratory Mouse (Second Edition)",2012,,,"Academic Press",,"http://www.sciencedirect.com/science/book/9780123820082"
"9780123978332","Recent Advances in Cancer Research and Therapy",2012,,,"Elsevier",,"http://www.sciencedirect.com/science/book/9780123978332"
"9780444594969","Proceedings of the 3rd International Gas Processing Symposium",2012,"1876-0147","Advances in Gas Processing","Elsevier",,"http://www.sciencedirect.com/science/book/9780444594969"
"9780123914309","Nuclear and Radiochemistry",2012,,,"Elsevier",,"http://www.sciencedirect.com/science/book/9780123914309"
"9780123910639","Usability in Government Systems",2012,,,"Morgan Kaufmann",,"http://www.sciencedirect.com/science/book/9780123910639"
"9781597494724","Malware Forensics Field Guide for Windows Systems",2012,,,"Syngress",,"http://www.sciencedirect.com/science/book/9781597494724"
"9780123869432","Actuaries' Survival Guide (Second Edition)",2012,,,"Academic Press",,"http://www.sciencedirect.com/science/book/9780123869432"
"9780444520029","Neurobiology of Psychiatric Disorders",2012,"0072-9752","Handbook of Clinical Neurology","Elsevier",,"http://www.sciencedirect.com/science/book/9780444520029"
"9780444538215","Origins of Human Innovation and Creativity",2012,"1571-0866","Developments in Quaternary Sciences","Elsevier",,"http://www.sciencedirect.com/science/book/9780444538215"
"9780323072557","Pediatric Surgery (Seventh Edition)",2012,,,"Mosby",,"http://www.sciencedirect.com/science/book/9780323072557"
"9781437716252","Best Evidence for Spine Surgery: 20 Cardinal Cases",2012,,,"W.B. Saunders",,"http://www.sciencedirect.com/science/book/9781437716252"
"9781437724110","Physical Rehabilitation of the Injured Athlete (Fourth Edition)",2012,,,"W.B. Saunders",,"http://www.sciencedirect.com/science/book/9781437724110"
"9781455701049","Essentials of Nuclear Medicine Imaging (Sixth Edition)",2012,,,"W.B. Saunders",,"http://www.sciencedirect.com/science/book/9781455701049"
"9781437701739","Veterinary Hematology",2012,,,"W.B. Saunders",,"http://www.sciencedirect.com/science/book/9781437701739"
"9780124160149","A Handbook of Magnetochemical Formulae",2012,,,"Elsevier",,"http://www.sciencedirect.com/science/book/9780124160149"
"9780124159495","IT Manager's Handbook (Third Edition)",2012,,,"Morgan Kaufmann",,"http://www.sciencedirect.com/science/book/9780124159495"
"9780123742360","The Human Nervous System (Third Edition)",2012,,,"Academic Press",,"http://www.sciencedirect.com/science/book/9780123742360"
"9780123854810","Pesticide Biotransformation and Disposition",2012,,,"Academic Press",,"http://www.sciencedirect.com/science/book/9780123854810"
"9780124160132","Dimensionless Physical Quantities in Science and Engineering",2012,,,"Elsevier",,"http://www.sciencedirect.com/science/book/9780124160132"
"9780122511004","Practical Chemical Thermodynamics for Geoscientists",2013,,,"Academic Press",,"http://www.sciencedirect.com/science/book/9780122511004"
"9780123979131","Mathematical Achievements of Pre-Modern Indian Mathematicians",2012,,,"Elsevier",,"http://www.sciencedirect.com/science/book/9780123979131"
"9780444593962","Models of the Ecological Hierarchy",2012,"0167-8892","Developments in Environmental Modelling","Elsevier",,"http://www.sciencedirect.com/science/book/9780444593962"
"9780123969521","Our Genes, Our Choices",2012,,,"Academic Press",,"http://www.sciencedirect.com/science/book/9780123969521"
"9780444538468","Engineering for Sustainability",2012,,,"Elsevier",,"http://www.sciencedirect.com/science/book/9780444538468"
"9780444543042","Water Quality Indices",2012,,,"Elsevier",,"http://www.sciencedirect.com/science/book/9780444543042"
"9780444563361","Nanoparticle Technology Handbook (Second Edition)",2012,,,"Elsevier",,"http://www.sciencedirect.com/science/book/9780444563361"
"9780123859716","Materials and the Environment (Second Edition)",2013,,,"Butterworth-Heinemann",,"http://www.sciencedirect.com/science/book/9780123859716"
"9780444563316","Molecularly Imprinted Sensors",2012,,,"Elsevier",,"http://www.sciencedirect.com/science/book/9780444563316"
"9780124158405","Construction Hazardous Materials Compliance Guide: Mold Detection, Abatement and Inspection Procedures",2012,,,"Butterworth-Heinemann",,"http://www.sciencedirect.com/science/book/9780124158405"
"9781437735260","Bottles, Preforms and Closures",2012,,,"William Andrew Publishing",,"http://www.sciencedirect.com/science/book/9781437735260"
"9780124159778","Highlights in Helioclimatology",2012,,,"Elsevier",,"http://www.sciencedirect.com/science/book/9780124159778"
"9780124157828","Laser Heating Applications",2012,,,"Elsevier",,"http://www.sciencedirect.com/science/book/9780124157828"
"9780124159563","Fundamentals of Motor Control",2013,,,"Academic Press",,"http://www.sciencedirect.com/science/book/9780124159563"
"9780323074186","Wounds and Lacerations (Fourth Edition)",2012,,,"W.B. Saunders",,"http://www.sciencedirect.com/science/book/9780323074186"
"9781416051985","Physics in Nuclear Medicine (Fourth Edition)",2012,,,"W.B. Saunders",,"http://www.sciencedirect.com/science/book/9781416051985"
"9781437719840","Kendig & Chernick's Disorders of the Respiratory Tract in Children (Eighth Edition)",2012,,,"W.B. Saunders",,"http://www.sciencedirect.com/science/book/9781437719840"
"9781437722079","Evidence-Based Physical Diagnosis (Third Edition)",2012,,,"W.B. Saunders",,"http://www.sciencedirect.com/science/book/9781437722079"
"9781437727630","Hemodynamics and Cardiology: Neonatology Questions and Controversies (Second Edition)",2012,,,"W.B. Saunders",,"http://www.sciencedirect.com/science/book/9781437727630"
"9781437736113","Neurology: Neonatology Questions and Controversies (Second Edition)",2012,,,"W.B. Saunders",,"http://www.sciencedirect.com/science/book/9781437736113"
"9781455703081","Aminoff's Electrodiagnosis in Clinical Neurology (Sixth Edition)",2012,,,"W.B. Saunders",,"http://www.sciencedirect.com/science/book/9781455703081"
"9780323085007","Critical Care Secrets (Fifth Edition)",2013,,,"Mosby",,"http://www.sciencedirect.com/science/book/9780323085007"
"9781437726077","Head and Neck Pathology (Second Edition)",2013,,,"W.B. Saunders",,"http://www.sciencedirect.com/science/book/9781437726077"
"9781437727661","Hypertension: A Companion to Braunwald's Heart Disease (Second Edition)",2012,,,"W.B. Saunders",,"http://www.sciencedirect.com/science/book/9781437727661"
"9781437729306","Vascular Medicine: A Companion to Braunwald's Heart Disease (Second Edition)",2013,,,"W.B. Saunders",,"http://www.sciencedirect.com/science/book/9781437729306"
"9781455706952","Sande's HIV/AIDS Medicine",2012,,,"W.B. Saunders",,"http://www.sciencedirect.com/science/book/9781455706952"
"9781455707928","Clinical Respiratory Medicine (Fourth Edition)",2012,,,"W.B. Saunders",,"http://www.sciencedirect.com/science/book/9781455707928"
"9780702031366","Lower Extremity Soft Tissue & Cutaneous Plastic Surgery (Second Edition)",2012,,,"W.B. Saunders",,"http://www.sciencedirect.com/science/book/9780702031366"
"9780124160453","Obesity",2013,,,"Elsevier",,"http://www.sciencedirect.com/science/book/9780124160453"
"9780444594129","Coal and Peat Fires: A Global Perspective",2012,,,"Elsevier",,"http://www.sciencedirect.com/science/book/9780444594129"
"9780123919144","Gas and Oil Reliability Engineering",2013,,,"Gulf Professional Publishing",,"http://www.sciencedirect.com/science/book/9780123919144"
"9780080971230","Marine Propellers and Propulsion (Third Edition)",2012,,,"Butterworth-Heinemann",,"http://www.sciencedirect.com/science/book/9780080971230"
"9780120885718","Environmental Fluid Dynamics",2013,,,"Academic Press",,"http://www.sciencedirect.com/science/book/9780120885718"
"9780123969897","Microstructure Sensitive Design for Performance Optimization",2013,,,"Butterworth-Heinemann",,"http://www.sciencedirect.com/science/book/9780123969897"
"9780123877123","Breakthrough Food Product Innovation Through Emotions Research",2012,,,"Academic Press",,"http://www.sciencedirect.com/science/book/9780123877123"
"9780123855442","Molecular Biology Techniques (Third Edition)",2012,,,"Academic Press",,"http://www.sciencedirect.com/science/book/9780123855442"
"9780123877383","Cell Physiology Source Book (Fourth Edition)",2011,,,"Academic Press",,"http://www.sciencedirect.com/science/book/9780123877383"
"9780080966595","Chemical Engineering Design (Second Edition)",2012,,,"Butterworth-Heinemann",,"http://www.sciencedirect.com/science/book/9780080966595"
"9780123849700","Organic Structure Determination Using 2-D NMR Spectroscopy (Second Edition)",2012,,,"Academic Press",,"http://www.sciencedirect.com/science/book/9780123849700"
"9780123859242","Flow Analysis with Spectrophotometric and Luminometric Detection",2012,,,"Elsevier",,"http://www.sciencedirect.com/science/book/9780123859242"
"9780123822338","Risk Analysis and the Security Survey (Fourth Edition)",2012,,,"Butterworth-Heinemann",,"http://www.sciencedirect.com/science/book/9780123822338"
"9780123854964","User Experience Management",2011,,,"Morgan Kaufmann",,"http://www.sciencedirect.com/science/book/9780123854964"
"9780123919229","Content Strategy at Work",2012,,,"Morgan Kaufmann",,"http://www.sciencedirect.com/science/book/9780123919229"
"9780123838322","Encyclopedia of Caves (Second Edition)",2012,,,"Academic Press",,"http://www.sciencedirect.com/science/book/9780123838322"
"9780123850485","Parameter Estimation and Inverse Problems (Second Edition)",2013,,,"Academic Press",,"http://www.sciencedirect.com/science/book/9780123850485"
"9780123822178","The Nuts and Bolts of Proofs (Fourth Edition)",2012,,,"Academic Press",,"http://www.sciencedirect.com/science/book/9780123822178"
"9780123919113","Clinical Trials",2012,,,"Academic Press",,"http://www.sciencedirect.com/science/book/9780123919113"
