"id","titulo","ano","issn","titulo_serie","editora","autor","url"
"9780444538567","Histopathology of Preclinical Toxicity Studies (Fourth Edition)",2012,,,"Academic Press",,"http://www.sciencedirect.com/science/book/9780444538567"
"9780124045606","Agricultural Sustainability",2013,,,"Academic Press",,"http://www.sciencedirect.com/science/book/9780124045606"
"9780123814623","Seldin and Giebisch's The Kidney (Fifth Edition)",2013,,,"Academic Press",,"http://www.sciencedirect.com/science/book/9780123814623"
"9780124071896","Federated Identity Primer",2013,,,"Syngress",,"http://www.sciencedirect.com/science/book/9780124071896"
"9780123821966","Embedded Systems Architecture (Second Edition)",2013,,,"Newnes",,"http://www.sciencedirect.com/science/book/9780123821966"
"9780127444833","Performance Evaluation and Attribution of Security Portfolios",2012,,,"Academic Press",,"http://www.sciencedirect.com/science/book/9780127444833"
"9780444626257","Bioscience and Bioengineering of Titanium Materials (Second Edition)",2013,,,"Elsevier",,"http://www.sciencedirect.com/science/book/9780444626257"
"9780123969637","R and Data Mining",2012,,,"Academic Press",,"http://www.sciencedirect.com/science/book/9780123969637"
"9780123970138","Multipoint Methods for Solving Nonlinear Equations",2013,,,"Academic Press",,"http://www.sciencedirect.com/science/book/9780123970138"
"9780124071773","Liquid Glass Transition",2013,,,"Elsevier",,"http://www.sciencedirect.com/science/book/9780124071773"
"9780444537867","Quantum Mechanics with Applications to Nanotechnology and Information Science",2012,,,"Academic Press",,"http://www.sciencedirect.com/science/book/9780444537867"
"9780123868992","Manual of Techniques in Invertebrate Pathology (Second Edition)",2012,,"0458/Biological Techniques Series","Academic Press",,"http://www.sciencedirect.com/science/book/9780123868992"
"9780123852120","Human Genes and Genomes",2013,,,"Academic Press",,"http://www.sciencedirect.com/science/book/9780123852120"
"9780080982069","Geothermal Power Plants (Third Edition)",2013,,,"Butterworth-Heinemann",,"http://www.sciencedirect.com/science/book/9780080982069"
"9781455725519","Film Properties of Plastics and Elastomers (Third Edition)",2012,,"Plastics Design Library","William Andrew Publishing",,"http://www.sciencedirect.com/science/book/9781455725519"
"9780123969743","Particulate Morphology",2012,,,"Elsevier",,"http://www.sciencedirect.com/science/book/9780123969743"
"9780124157873","Global Clinical Trials Playbook",2012,,,"Academic Press",,"http://www.sciencedirect.com/science/book/9780124157873"
"9780123846563","Fusion (Second Edition)",2012,,"1514/Complementary Science","Academic Press",,"http://www.sciencedirect.com/science/book/9780123846563"
"9780124159532","Agile User Experience Design",2013,,,"Morgan Kaufmann",,"http://www.sciencedirect.com/science/book/9780124159532"
"9780123970237","Nonlinear Fiber Optics (Fifth Edition)",2013,,"Optics and Photonics","Academic Press",,"http://www.sciencedirect.com/science/book/9780123970237"
"9780123943859","Eosinophils in Health and Disease",2012,,,"Academic Press",,"http://www.sciencedirect.com/science/book/9780123943859"
"9780123869456","Translational Neuroimaging",2012,,,"Academic Press",,"http://www.sciencedirect.com/science/book/9780123869456"
"9780080971339","Underneath the Bragg Peaks",2012,"1470-1804","Pergamon Materials Series","Pergamon",,"http://www.sciencedirect.com/science/book/9780080971339"
"9780444538369","Bioactive Natural Products",2012,"1572-5995","Studies in Natural Products Chemistry","Elsevier",,"http://www.sciencedirect.com/science/book/9780444538369"
"9780123848628","Chemical Analysis of Food: Techniques and Applications",2012,,,"Academic Press",,"http://www.sciencedirect.com/science/book/9780123848628"
"9780123944252","Data Virtualization for Business Intelligence Systems",2012,,,"Morgan Kaufmann",,"http://www.sciencedirect.com/science/book/9780123944252"
"9780123978264","Understanding the Chinese Economies",2013,,,"Academic Press",,"http://www.sciencedirect.com/science/book/9780123978264"
"9780080966526","Manual of Engineering Drawing (Fourth Edition)",2012,,,"Butterworth-Heinemann",,"http://www.sciencedirect.com/science/book/9780080966526"
"9780123859204","Control System Design Guide (Fourth Edition)",2012,,,"Butterworth-Heinemann",,"http://www.sciencedirect.com/science/book/9780123859204"
"9780123868862","Embedded Systems Security",2012,,,"Newnes",,"http://www.sciencedirect.com/science/book/9780123868862"
"9780123969941","Hydrostatic, Aerostatic and Hybrid Bearing Design",2013,,,"Butterworth-Heinemann",,"http://www.sciencedirect.com/science/book/9780123969941"
"9780080971728","Nanotechnology Cookbook",2012,,,"Elsevier",,"http://www.sciencedirect.com/science/book/9780080971728"
"9780444595300","Bioactive Natural Products",2012,"1572-5995","Studies in Natural Products Chemistry","Elsevier",,"http://www.sciencedirect.com/science/book/9780444595300"
"9780444529893","Sulfidic Sediments and Sedimentary Rocks",2012,"0070-4571","Developments in Sedimentology","Elsevier",,"http://www.sciencedirect.com/science/book/9780444529893"
"9780323086974","Cardiovascular Physiology (Tenth Edition)",2013,,,"Content Repository Only!",,"http://www.sciencedirect.com/science/book/9780323086974"
"9781455726721","Electromyography and Neuromuscular Disorders (Third Edition)",2013,,,"W.B. Saunders",,"http://www.sciencedirect.com/science/book/9781455726721"
"9781416039693","Clinical Veterinary Advisor: Birds and Exotic Pets",2013,,,"W.B. Saunders",,"http://www.sciencedirect.com/science/book/9781416039693"
"9781455707171","Small Animal Toxicology (Third Edition)",2013,,,"W.B. Saunders",,"http://www.sciencedirect.com/science/book/9781455707171"
"9780123820860","Sensory Evaluation Practices (Fourth Edition)",2012,"1082-0132","Food Science and Technology","Academic Press",,"http://www.sciencedirect.com/science/book/9780123820860"
"9780123847270","Scientific Papers and Presentations (Third Edition)",2013,,,"Academic Press",,"http://www.sciencedirect.com/science/book/9780123847270"
"9780123971890","Lees' Loss Prevention in the Process Industries (Fourth Edition)",2012,,,"Butterworth-Heinemann",,"http://www.sciencedirect.com/science/book/9780123971890"
"9780444537881","Next Generation of International Chemical Additives",2013,,,"Elsevier",,"http://www.sciencedirect.com/science/book/9780444537881"
"9780123985279","Synchronous Precharge Logic",2012,,,"Elsevier",,"http://www.sciencedirect.com/science/book/9780123985279"
"9780124159341","Collaborative Enterprise Architecture",2012,,,"Morgan Kaufmann",,"http://www.sciencedirect.com/science/book/9780124159341"
"9781597499897","Practical Lock Picking (Second Edition)",2012,,,"Syngress",,"http://www.sciencedirect.com/science/book/9781597499897"
"9780123860453","Machinery Failure Analysis and Troubleshooting (Fourth Edition)",2012,,,"Butterworth-Heinemann",,"http://www.sciencedirect.com/science/book/9780123860453"
"9780123869425","Numerical Methods (Third Edition)",2012,,,"Academic Press",,"http://www.sciencedirect.com/science/book/9780123869425"
"9780123965493","Feature Extraction & Image Processing for Computer Vision (Third Edition)",2013,,,"Academic Press",,"http://www.sciencedirect.com/science/book/9780123965493"
"9780123984081","Up and Running with AutoCAD 2013 (Second Edition)",2013,,,"Academic Press",,"http://www.sciencedirect.com/science/book/9780123984081"
"9780123984166","Up and Running with AutoCAD 2013 (Third Edition)",2013,,,"Academic Press",,"http://www.sciencedirect.com/science/book/9780123984166"
"9781455731107","Chemical Resistance of Specialty Thermoplastics",2012,,"Plastics Design Library","William Andrew Publishing",,"http://www.sciencedirect.com/science/book/9781455731107"
"9780123919465","Project Finance in Theory and Practice (Second Edition)",2013,,,"Academic Press",,"http://www.sciencedirect.com/science/book/9780123919465"
"9780124158207","Investment Banks, Hedge Funds, and Private Equity (Second Edition)",2012,,,"Academic Press",,"http://www.sciencedirect.com/science/book/9780124158207"
"9780123865434","Introduction to Crime Scene Photography",2013,,,"Academic Press",,"http://www.sciencedirect.com/science/book/9780123865434"
"9780123945853","Forensic DNA Biology",2013,,,"Academic Press",,"http://www.sciencedirect.com/science/book/9780123945853"
"9780123985187","Practical Skills and Clinical Management of Alcoholism & Drug Addiction",2012,,,"Elsevier",,"http://www.sciencedirect.com/science/book/9780123985187"
"9780123918840","Nutrition in the Prevention and Treatment of Disease (Third Edition)",2013,,,"Academic Press",,"http://www.sciencedirect.com/science/book/9780123918840"
"9780123851017","Autophagy in Health and Disease",2013,,,"Academic Press",,"http://www.sciencedirect.com/science/book/9780123851017"
"9780124160125","Resident Stem Cells and Regenerative Therapy",2013,,,"Academic Press",,"http://www.sciencedirect.com/science/book/9780124160125"
"9780444593993","Environmental Water",2013,,,"Elsevier",,"http://www.sciencedirect.com/science/book/9780444593993"
"9780123850133","Essentials in Modern HPLC Separations",2013,,,"Elsevier",,"http://www.sciencedirect.com/science/book/9780123850133"
"9780123851109","Inorganic Chemistry (Second Edition)",2013,,,"Academic Press",,"http://www.sciencedirect.com/science/book/9780123851109"
"9780123858894","Business Intelligence (Second Edition)",2013,,"MK Series on Business Intelligence","Morgan Kaufmann",,"http://www.sciencedirect.com/science/book/9780123858894"
"9780123877932","Data Insights",2012,,,"Morgan Kaufmann",,"http://www.sciencedirect.com/science/book/9780123877932"
"9780124158030","Homeland Security",2013,,,"Butterworth-Heinemann",,"http://www.sciencedirect.com/science/book/9780124158030"
"9780080982434","Computational Fluid Dynamics (Second Edition)",2013,,,"Butterworth-Heinemann",,"http://www.sciencedirect.com/science/book/9780080982434"
"9780123914217","Acoustics: Sound Fields and Transducers",2012,,,"Academic Press",,"http://www.sciencedirect.com/science/book/9780123914217"
"9780123970152","Pressure Vessels Field Manual",2013,,,"Gulf Professional Publishing",,"http://www.sciencedirect.com/science/book/9780123970152"
"9781437778816","Developments in Surface Contamination and Cleaning: Contaminant Removal and Monitoring",2013,,,"William Andrew Publishing",,"http://www.sciencedirect.com/science/book/9781437778816"
"9780123852472","International Money and Finance (Eighth Edition)",2013,,,"Academic Press",,"http://www.sciencedirect.com/science/book/9780123852472"
"9780123851895","Research Methods in Human Skeletal Biology",2013,,,"Academic Press",,"http://www.sciencedirect.com/science/book/9780123851895"
"9780123850898","Nanomaterials for Medical Applications",2013,,,"Elsevier",,"http://www.sciencedirect.com/science/book/9780123850898"
"9780123854711","Principles of Clinical Pharmacology (Third Edition)",2013,,,"Academic Press",,"http://www.sciencedirect.com/science/book/9780123854711"
"9780123822192","Handbook of Proteolytic Enzymes (Third Edition)",2013,,,"Academic Press",,"http://www.sciencedirect.com/science/book/9780123822192"
"9780124047372","The Basics of Cyber Warfare",2013,,,"Syngress",,"http://www.sciencedirect.com/science/book/9780124047372"
"9781597497312","Wireless Reconnaissance in Penetration Testing",2013,,,"Syngress",,"http://www.sciencedirect.com/science/book/9781597497312"
"9781597497336","Augmented Reality",2013,,,"Syngress",,"http://www.sciencedirect.com/science/book/9781597497336"
"9781597497435","Data Hiding",2013,,,"Syngress",,"http://www.sciencedirect.com/science/book/9781597497435"
"9781597499576","Violent Python",2013,,,"Syngress",,"http://www.sciencedirect.com/science/book/9781597499576"
"9780080970899","Exergy (Second Edition)",2013,,,"Elsevier",,"http://www.sciencedirect.com/science/book/9780080970899"
"9780123919427","Medical Device Design",2013,,,"Academic Press",,"http://www.sciencedirect.com/science/book/9780123919427"
"9780123884381","Enological Chemistry",2012,,,"Academic Press",,"http://www.sciencedirect.com/science/book/9780123884381"
"9780080970165","Tire and Vehicle Dynamics (Third Edition)",2012,,,"Butterworth-Heinemann",,"http://www.sciencedirect.com/science/book/9780080970165"
"9780123854919","Quantum Information Processing and Quantum Error Correction",2012,,,"Academic Press",,"http://www.sciencedirect.com/science/book/9780123854919"
"9781437716047","Goldman's Cecil Medicine (Twenty Fourth Edition)",2012,,,"W.B. Saunders",,"http://www.sciencedirect.com/science/book/9781437716047"
"9780124160439","Agriculture's Ethical Horizon (Second Edition)",2012,,,"Elsevier",,"http://www.sciencedirect.com/science/book/9780124160439"
"9780123809322","Solid Fuel Blending",2012,,,"Butterworth-Heinemann",,"http://www.sciencedirect.com/science/book/9780123809322"
"9780124158221","Embedded Software (Second Edition)",2012,,,"Newnes",,"http://www.sciencedirect.com/science/book/9780124158221"
"9780123820105","Differential Equations, Dynamical Systems, and an Introduction to Chaos (Third Edition)",2013,,,"Academic Press",,"http://www.sciencedirect.com/science/book/9780123820105"
"9780124160477","Nerve Agents Poisoning and its Treatment in Schematic Figures and Tables",2012,,,"Elsevier",,"http://www.sciencedirect.com/science/book/9780124160477"
"9780123838827","Human Growth and Development (Second Edition)",2013,,,"Academic Press",,"http://www.sciencedirect.com/science/book/9780123838827"
"9780123884152","Epigenetics in Human Disease",2012,,,"Academic Press",,"http://www.sciencedirect.com/science/book/9780123884152"
"9780124157941","Practical Biostatistics",2012,,,"Academic Press",,"http://www.sciencedirect.com/science/book/9780124157941"
"9780123877857","Rules of Thumb for Chemical Engineers (Fifth Edition)",2012,,,"Butterworth-Heinemann",,"http://www.sciencedirect.com/science/book/9780123877857"
"9780123855404","Gas Chromatography",2012,,,"Elsevier",,"http://www.sciencedirect.com/science/book/9780123855404"
"9780124160446","Principles of Data Integration",2012,,,"Morgan Kaufmann",,"http://www.sciencedirect.com/science/book/9780124160446"
"9780080982625","A Guide to Ship Repair Estimates in Man-hours (Second Edition)",2013,,,"Butterworth-Heinemann",,"http://www.sciencedirect.com/science/book/9780080982625"
"9780123970169","Heat Exchanger Equipment Field Manual",2013,,,"Gulf Professional Publishing",,"http://www.sciencedirect.com/science/book/9780123970169"
"9780123970367","Flexible Manipulators",2013,,,"Academic Press",,"http://www.sciencedirect.com/science/book/9780123970367"
"9780123970374","Service Science, Management, and Engineering:",2013,,,"Academic Press",,"http://www.sciencedirect.com/science/book/9780123970374"
"9780123972002","New Advances in Intelligence and Security Informatics",2013,,,"Academic Press",,"http://www.sciencedirect.com/science/book/9780123972002"
"9780123982773","Collected Works of H.S. Tsien (19381956)",2012,,,"Elsevier",,"http://www.sciencedirect.com/science/book/9780123982773"
"9780124159075","Switchmode RF and Microwave Power Amplifiers (Second Edition)",2012,,,"Academic Press",,"http://www.sciencedirect.com/science/book/9780124159075"
"9781597497275","Windows Forensic Analysis Toolkit (Third Edition)",2012,,,"Syngress",,"http://www.sciencedirect.com/science/book/9781597497275"
"9780123854674","Therapeutic Drug Monitoring",2012,,,"Academic Press",,"http://www.sciencedirect.com/science/book/9780123854674"
"9780444521385","Neuro-Oncology",2012,"0072-9752","Handbook of Clinical Neurology","Elsevier",,"http://www.sciencedirect.com/science/book/9780444521385"
"9780444535023","Neuro-Oncology Part II",2012,"0072-9752","Handbook of Clinical Neurology","Elsevier",,"http://www.sciencedirect.com/science/book/9780444535023"
"9780444563668","Principles of Filtration",2012,,,"Elsevier",,"http://www.sciencedirect.com/science/book/9780444563668"
"9780444530424","Regional Geology and Tectonics: Principles of Geologic Analysis",2012,,,"Elsevier",,"http://www.sciencedirect.com/science/book/9780444530424"
"9780124159167","Dissolved Gas Concentration in Water (Second Edition)",2012,,,"Elsevier",,"http://www.sciencedirect.com/science/book/9780124159167"
"9781597496612","The Basics of Digital Forensics",2012,,,"Syngress",,"http://www.sciencedirect.com/science/book/9781597496612"
"9780123846549","Mathematical Methods for Physicists (Seventh Edition)",2012,,,"Academic Press",,"http://www.sciencedirect.com/science/book/9780123846549"
"9780123859426","Handbook of Stem Cells (Second Edition)",2013,,,"Academic Press",,"http://www.sciencedirect.com/science/book/9780123859426"
"9780124157842","Translational Endocrinology of Bone",2013,,,"Academic Press",,"http://www.sciencedirect.com/science/book/9780124157842"
"9780123969590","Chemical Process Equipment (Third Edition)",2010,,,"Butterworth-Heinemann",,"http://www.sciencedirect.com/science/book/9780123969590"
"9780444595256","Bioprocess Engineering",2013,,,"Elsevier",,"http://www.sciencedirect.com/science/book/9780444595256"
"9780124158115","Using Open Source Platforms for Business Intelligence",2012,,,"Morgan Kaufmann",,"http://www.sciencedirect.com/science/book/9780124158115"
"9780123877109","PEM Fuel Cells (Second Edition)",2013,,,"Academic Press",,"http://www.sciencedirect.com/science/book/9780123877109"
"9780123970305","Common Well Control Hazards",2013,,,"Gulf Professional Publishing",,"http://www.sciencedirect.com/science/book/9780123970305"
"9781455725984","The Effect of Sterilization on Plastics and Elastomers (Third Edition)",2012,,,"William Andrew Publishing",,"http://www.sciencedirect.com/science/book/9781455725984"
"9780124158498","The Blood Group Antigen FactsBook (Third Edition)",2012,,"Factsbook","Academic Press",,"http://www.sciencedirect.com/science/book/9780124158498"
"9780323086912","Renal Physiology (Fifth Edition)",2013,,,"Mosby",,"http://www.sciencedirect.com/science/book/9780323086912"
"9780323087049","Endocrine and Reproductive Physiology (Fourth Edition)",2013,,,"Mosby",,"http://www.sciencedirect.com/science/book/9780323087049"
"9781437718935","Dubois' Lupus Erythematosus and Related Syndromes  (Eighth Edition)",2013,,,"W.B. Saunders",,"http://www.sciencedirect.com/science/book/9781437718935"
"9781437727647","Benumof and Hagberg's Airway Management",2013,,,"W.B. Saunders",,"http://www.sciencedirect.com/science/book/9781437727647"
"9781455700905","Vaccines (Sixth Edition)",2013,,,"W.B. Saunders",,"http://www.sciencedirect.com/science/book/9781455700905"
"9781455701018","Cardiovascular Therapeutics: A Companion to Braunwald's Heart Disease (Fourth Edition)",2013,,,"W.B. Saunders",,"http://www.sciencedirect.com/science/book/9781455701018"
"9780123849786","Women and Health (Second Edition)",2013,,,"Academic Press",,"http://www.sciencedirect.com/science/book/9780123849786"
"9780123918543","Periodic Operation of Chemical Reactors",2013,,,"Butterworth-Heinemann",,"http://www.sciencedirect.com/science/book/9780123918543"
"9780123971616","Dynamic Well Testing in Petroleum Exploration and Development",2013,,,"Elsevier",,"http://www.sciencedirect.com/science/book/9780123971616"
"9780123750907","Handbook of Hydrothermal Technology (Second Edition)",2013,,"S485/Materials Sci & Process Tech","William Andrew Publishing",,"http://www.sciencedirect.com/science/book/9780123750907"
"9781455731121","Plastic Films in Food Packaging",2013,,"Plastics Design Library","William Andrew Publishing",,"http://www.sciencedirect.com/science/book/9781455731121"
"9781455731275","Nanobiomaterials in Clinical Dentistry",2013,,,"William Andrew Publishing",,"http://www.sciencedirect.com/science/book/9781455731275"
"9780120887743","Fundamentals of Ecosystem Science",2012,,,"Academic Press",,"http://www.sciencedirect.com/science/book/9780120887743"
"9780444518927","Ataxic Disorders",2012,"0072-9752","Handbook of Clinical Neurology","Elsevier",,"http://www.sciencedirect.com/science/book/9780444518927"
"9780444538130","Trace Fossils as Indicators of Sedimentary Environments",2012,"0070-4571","Developments in Sedimentology","Elsevier",,"http://www.sciencedirect.com/science/book/9780444538130"
"9780123869036","Geometric Morphometrics for Biologists (Second Edition)",2012,,,"Academic Press",,"http://www.sciencedirect.com/science/book/9780123869036"
"9780124159204","Plant Tissue Culture (Third Edition)",2013,,,"Academic Press",,"http://www.sciencedirect.com/science/book/9780124159204"
"9780123985101","Modern Computational Approaches to Traditional Chinese Medicine",2012,,,"Elsevier",,"http://www.sciencedirect.com/science/book/9780123985101"
"9780123859549","Advanced Remote Sensing",2012,,,"Academic Press",,"http://www.sciencedirect.com/science/book/9780123859549"
"9780123849953","Sleep and Brain Activity",2012,,,"Academic Press",,"http://www.sciencedirect.com/science/book/9780123849953"
"9780123979162","Adolescent Brain Development",2012,,,"Academic Press",,"http://www.sciencedirect.com/science/book/9780123979162"
"9780123819598","Sketching User Experiences: The Workbook",2012,,,"Morgan Kaufmann",,"http://www.sciencedirect.com/science/book/9780123819598"
"9781437744590","Polylactic Acid",2013,,,"William Andrew Publishing",,"http://www.sciencedirect.com/science/book/9781437744590"
"9780123884350","Intersection",2013,,,"Morgan Kaufmann",,"http://www.sciencedirect.com/science/book/9780123884350"
"9780124157965","Introduction to Data Compression (Fourth Edition)",2012,,"The Morgan Kaufmann Series in Multimedia Information and Systems","Morgan Kaufmann",,"http://www.sciencedirect.com/science/book/9780124157965"
"9781597495905","Client-Side Attacks and Defense",2013,,,"Syngress",,"http://www.sciencedirect.com/science/book/9781597495905"
"9780123948069","Boundary Layer Flow over Elastic Surfaces",2013,,,"Butterworth-Heinemann",,"http://www.sciencedirect.com/science/book/9780123948069"
"9780123822277","Genomic and Personalized Medicine (Second Edition)",2013,,,"Academic Press",,"http://www.sciencedirect.com/science/book/9780123822277"
"9780123859440","Handbook of Systems Biology",2013,,,"Academic Press",,"http://www.sciencedirect.com/science/book/9780123859440"
"9780123985002","Security Consulting (Fourth Edition)",2013,,,"Butterworth-Heinemann",,"http://www.sciencedirect.com/science/book/9780123985002"
"9780123746269","Biomaterials Science (Third Edition)",2013,,,"Academic Press",,"http://www.sciencedirect.com/science/book/9780123746269"
"9780123945839","The RF in RFID (Second Edition)",2013,,,"Newnes",,"http://www.sciencedirect.com/science/book/9780123945839"
"9780123910592","Sexually Transmitted Diseases (Second Edition)",2013,,,"Academic Press",,"http://www.sciencedirect.com/science/book/9780123910592"
"9780123878397","Molecular Beam Epitaxy: From Research to Mass Production",2013,,,"Elsevier",,"http://www.sciencedirect.com/science/book/9780123878397"
"9780123814609","The Psychology of Music (Third Edition)",2013,,,"Academic Press",,"http://www.sciencedirect.com/science/book/9780123814609"
"9780444536389","Biostratigraphic and Geological Significance of Planktonic Foraminifera",2012,"0920-5446","Developments in Palaeontology and Stratigraphy","Elsevier",,"http://www.sciencedirect.com/science/book/9780444536389"
"9780123821676","Principles and Practice of Clinical Research (Third Edition)",2012,,,"Academic Press",,"http://www.sciencedirect.com/science/book/9780123821676"
"9780123865311","Design for Emotion",2012,,,"Morgan Kaufmann",,"http://www.sciencedirect.com/science/book/9780123865311"
"9780123884442","Handbook of Environmental Engineering Assessment",2012,,,"Butterworth-Heinemann",,"http://www.sciencedirect.com/science/book/9780123884442"
"9780124158382","Construction Hazardous Materials Compliance Guide:  Lead Detection, Abatement, and Inspection Procedures",2012,,,"Butterworth-Heinemann",,"http://www.sciencedirect.com/science/book/9780124158382"
"9780444594211","Environmentally Benign Approaches for Pulp Bleaching (Second Edition)",2012,,,"Elsevier",,"http://www.sciencedirect.com/science/book/9780444594211"
"9780444536365","Ostracoda as Proxies for Quaternary Climate Change",2012,"1571-0866","Developments in Quaternary Sciences","Elsevier",,"http://www.sciencedirect.com/science/book/9780444536365"
"9780123948045","Welding Deformation and Residual Stress Prevention",2013,,,"Butterworth-Heinemann",,"http://www.sciencedirect.com/science/book/9780123948045"
"9780123848734","Handbook of Radioactivity Analysis (Third Edition)",2012,,,"Academic Press",,"http://www.sciencedirect.com/science/book/9780123848734"
"9781597499484","PCI Compliance (Third Edition)",2012,,,"Syngress",,"http://www.sciencedirect.com/science/book/9781597499484"
"9781597499835","Keys to the Kingdom",2012,,,"Syngress",,"http://www.sciencedirect.com/science/book/9781597499835"
"9780123847058","Groundwater Science (Second Edition)",2012,,,"Academic Press",,"http://www.sciencedirect.com/science/book/9780123847058"
"9780080977447","Novel Carbon Adsorbents",2012,,,"Elsevier",,"http://www.sciencedirect.com/science/book/9780080977447"
"9780123884091","Learning About Learning Disabilities (Fourth Edition)",2013,,,"Academic Press",,"http://www.sciencedirect.com/science/book/9780123884091"
"9780444563477","High-Pressure Fluid Phase Equilibria",2012,"2212-0505","Supercritical Fluid Science and Technology","Elsevier",,"http://www.sciencedirect.com/science/book/9780444563477"
"9780080963570","Metal Nanoparticles and Nanoalloys",2012,"1876-2778","Frontiers of Nanoscience","Elsevier",,"http://www.sciencedirect.com/science/book/9780080963570"
"9780123850515","Writing Effective Business Rules",2012,,,"Morgan Kaufmann",,"http://www.sciencedirect.com/science/book/9780123850515"
"9780444517470","Philosophy of Linguistics",2012,,"Handbook of the Philosophy of Science","North-Holland",,"http://www.sciencedirect.com/science/book/9780444517470"
