"id","titulo","ano","issn","titulo_serie","editora","autor","url"
"9780444534750","Wave Length and Action Potentials: History of the International Federation of Clinical Neurophysiology",2010,"1567-424X","Supplements to Clinical Neurophysiology","Elsevier",,"http://www.sciencedirect.com/science/book/9780444534750"
"9780123756909","Calculations for Molecular Biology and Biotechnology (Second Edition)",2011,,,"Academic Press",,"http://www.sciencedirect.com/science/book/9780123756909"
"9780444535603","Analytical Modelling of Fuel Cells",2010,,,"Elsevier",,"http://www.sciencedirect.com/science/book/9780444535603"
"9780123749130","Information Systems Transformation",2010,,"The MK/OMG Press","Morgan Kaufmann",,"http://www.sciencedirect.com/science/book/9780123749130"
"9780123847157","Trap Level Spectroscopy in Amorphous Semiconductors",2010,,,"Elsevier",,"http://www.sciencedirect.com/science/book/9780123847157"
"9780123749468","Crew Resource Management (Second Edition)",2010,,,"Academic Press",,"http://www.sciencedirect.com/science/book/9780123749468"
"9780123746344","Handbook of the Behavioral Neurobiology of Serotonin",2010,"1569-7339","Handbook of Behavioral Neuroscience","Elsevier",,"http://www.sciencedirect.com/science/book/9780123746344"
"9780444535658","Electric and Hybrid Vehicles",2010,,,"Elsevier",,"http://www.sciencedirect.com/science/book/9780444535658"
"9781856176323","Membrane Technology",2010,,,"Butterworth-Heinemann",,"http://www.sciencedirect.com/science/book/9781856176323"
"9780750681599","The Repo Handbook (Second Edition)",2010,,"291R/Securities Institute Global Capital Markets","Butterworth-Heinemann",,"http://www.sciencedirect.com/science/book/9780750681599"
"9780123756688","Treatment of Eating Disorders",2010,,,"Academic Press",,"http://www.sciencedirect.com/science/book/9780123756688"
"9780444535443","The Brain and Host Defense",2010,"1567-7443","NeuroImmune Biology","Elsevier",,"http://www.sciencedirect.com/science/book/9780444535443"
"9780444536013","Scientific Bases for the Preparation of Heterogeneous Catalysts",2010,"0167-2991","Studies in Surface Science and Catalysis","Elsevier",,"http://www.sciencedirect.com/science/book/9780444536013"
"9780444536211","Characterization of Liquids, Nano- and Microparticulates, and Porous Bodies Using Ultrasound",2010,"1383-7303","Studies in Interface Science","Elsevier",,"http://www.sciencedirect.com/science/book/9780444536211"
"9780123821713","The HDL Handbook",2010,,,"Academic Press",,"http://www.sciencedirect.com/science/book/9780123821713"
"9780123750419","Managing Time in Relational Databases",2010,,,"Morgan Kaufmann",,"http://www.sciencedirect.com/science/book/9780123750419"
"9780123822291","Analyzing Social Media Networks with NodeXL",2011,,,"Morgan Kaufmann",,"http://www.sciencedirect.com/science/book/9780123822291"
"9781597495684","Dissecting the Hack (Revised First Edition)",2010,,,"Syngress",,"http://www.sciencedirect.com/science/book/9781597495684"
"9781856179782","Metrics and Methods for Security Risk Management",2010,,,"Syngress",,"http://www.sciencedirect.com/science/book/9781856179782"
"9780815515456","Micro-Manufacturing Engineering and Technology",2010,,"Micro and Nano Technologies","William Andrew Publishing",,"http://www.sciencedirect.com/science/book/9780815515456"
"9780123749611","Handbook of Assessment in Clinical Gerontology (Second Edition)",2010,,,"Academic Press",,"http://www.sciencedirect.com/science/book/9780123749611"
"9780444531155","Sustainable Water for the Future: Water Recycling versus Desalination",2010,"1871-2711","Sustainability Science and Engineering","Elsevier",,"http://www.sciencedirect.com/science/book/9780444531155"
"9780444530257","Carbonates in Continental Settings: Facies, Environments, and Processes",2010,"0070-4571","Developments in Sedimentology","Elsevier",,"http://www.sciencedirect.com/science/book/9780444530257"
"9780080452623","Active Geophysical Monitoring",2010,"0950-1401","Handbook of Geophysical Exploration: Seismic Exploration","Pergamon",,"http://www.sciencedirect.com/science/book/9780080452623"
"9780123814951","A History of Weed Science in the United States",2010,,,"Elsevier",,"http://www.sciencedirect.com/science/book/9780123814951"
"9780123747679","Handbook of Basal Ganglia Structure and Function",2010,"1569-7339","Handbook of Behavioral Neuroscience","Elsevier",,"http://www.sciencedirect.com/science/book/9780123747679"
"9780123815088","Aging, Ageism and Abuse",2010,,,"Elsevier",,"http://www.sciencedirect.com/science/book/9780123815088"
"9780444521392","Headache",2010,"0072-9752","Handbook of Clinical Neurology","Elsevier",,"http://www.sciencedirect.com/science/book/9780444521392"
"9781416063933","Child Abuse and Neglect",2010,,,"W.B. Saunders",,"http://www.sciencedirect.com/science/book/9781416063933"
"9780443068133","A Guide to Sports and Injury Management",2010,,,"Churchill Livingstone",,"http://www.sciencedirect.com/science/book/9780443068133"
"9780702030420","Pocket Podiatry: Footwear and Foot Orthoses",2010,,,"Churchill Livingstone",,"http://www.sciencedirect.com/science/book/9780702030420"
"9781437701500","Diagnostic Radiology and Ultrasonography of the Dog and Cat (Fifth Edition)",2011,,,"W.B. Saunders",,"http://www.sciencedirect.com/science/book/9781437701500"
"9780123741455","Handbook of Cell Signaling (Second Edition)",2009,,"S165/Cell Biology","Academic Press",,"http://www.sciencedirect.com/science/book/9780123741455"
"9780123815200","Agile Development & Business Goals",2010,,,"Morgan Kaufmann",,"http://www.sciencedirect.com/science/book/9780123815200"
"9781856178556","Enhanced Oil Recovery: Field Planning and Development Strategies",2010,,,"Gulf Professional Publishing",,"http://www.sciencedirect.com/science/book/9781856178556"
"9780323057127","Neurology Secrets (Fifth Edition)",2011,,,"Mosby",,"http://www.sciencedirect.com/science/book/9780323057127"
"9780750698528","Movement Disorders in Childhood",2010,,,"W.B. Saunders",,"http://www.sciencedirect.com/science/book/9780750698528"
"9781416036241","Tumors and Tumor-Like Conditions of the Lung and Pleura",2010,,,"W.B. Saunders",,"http://www.sciencedirect.com/science/book/9781416036241"
"9781416054764","Evidence-Based Practice of Critical Care",2010,,,"W.B. Saunders",,"http://www.sciencedirect.com/science/book/9781416054764"
"9780080450438","Responding to Terrorism",2010,,,"Churchill Livingstone",,"http://www.sciencedirect.com/science/book/9780080450438"
"9780443067822","Acupuncture in Manual Therapy",2010,,,"Churchill Livingstone",,"http://www.sciencedirect.com/science/book/9780443067822"
"9780702031076","Foot and Ankle Injection Techniques",2010,,,"Churchill Livingstone",,"http://www.sciencedirect.com/science/book/9780702031076"
"9780702031106","Reflexology in Pregnancy and Childbirth",2010,,,"Churchill Livingstone",,"http://www.sciencedirect.com/science/book/9780702031106"
"9780323066198","Canine and Feline Nutrition (Third Edition)",2011,,,"Mosby",,"http://www.sciencedirect.com/science/book/9780323066198"
"9780702028175","Cardiology of the Horse (Second Edition)",2010,,,"W.B. Saunders",,"http://www.sciencedirect.com/science/book/9780702028175"
"9781416048893","Small Animal Pediatrics",2011,,,"W.B. Saunders",,"http://www.sciencedirect.com/science/book/9781416048893"
"9780123757098","Handbook of Epigenetics",2011,,,"Academic Press",,"http://www.sciencedirect.com/science/book/9780123757098"
"9780444532626","Handbook of Biosensors and Biosensor Kinetics",2011,,,"Elsevier",,"http://www.sciencedirect.com/science/book/9780444532626"
"9780080958439","Handbook of Heterocyclic Chemistry (Third Edition)",2010,,,"Elsevier",,"http://www.sciencedirect.com/science/book/9780080958439"
"9780444531568","Interpretation of Micromorphological Features of Soils and Regoliths",2010,,,"Elsevier",,"http://www.sciencedirect.com/science/book/9780444531568"
"9780123750273","Statistical Signal Processing for Neuroscience and Neurotechnology",2010,,,"Academic Press",,"http://www.sciencedirect.com/science/book/9780123750273"
"9781437778076","Advanced Industrial Control Technology",2010,,,"William Andrew Publishing",,"http://www.sciencedirect.com/science/book/9781437778076"
"9781856177269","Electricity Cost Modeling Calculations",2010,,,"Academic Press",,"http://www.sciencedirect.com/science/book/9781856177269"
"9781856179454","Natural Gas Hydrates in Flow Assurance",2010,,,"Gulf Professional Publishing",,"http://www.sciencedirect.com/science/book/9781856179454"
"9780123819864","Effective Interviewing and Interrogation Techniques (Third Edition)",2011,,,"Academic Press",,"http://www.sciencedirect.com/science/book/9780123819864"
"9780123749956","Global Perspectives on Childhood Obesity",2011,,,"Academic Press",,"http://www.sciencedirect.com/science/book/9780123749956"
"9780123756701","Osteoimmunology",2011,,,"Academic Press",,"http://www.sciencedirect.com/science/book/9780123756701"
"9780123756725","Biomarkers of Kidney Disease",2010,,,"Academic Press",,"http://www.sciencedirect.com/science/book/9780123756725"
"9780123849076","Human Chorionic Gonadotropin",2010,,,"Elsevier",,"http://www.sciencedirect.com/science/book/9780123849076"
"9780123849151","Signal Processing for Neuroscientists, A Companion Volume",2010,,,"Elsevier",,"http://www.sciencedirect.com/science/book/9780123849151"
"9780123736970","Cu(InGa)Se2 Based Thin Film Solar Cells",2010,"1543-5016","Thin Films and Nanostructures","Academic Press",,"http://www.sciencedirect.com/science/book/9780123736970"
"9780123751423","Analysis of Complex Disease Association Studies",2011,,,"Academic Press",,"http://www.sciencedirect.com/science/book/9780123751423"
"9781597495882","Ninja Hacking",2010,,,"Syngress",,"http://www.sciencedirect.com/science/book/9781597495882"
"9780815520474","Valuing Wind Generation on Integrated Power Systems",2010,,,"William Andrew Publishing",,"http://www.sciencedirect.com/science/book/9780815520474"
"9780750684552","Demystifying Embedded Systems Middleware",2010,,,"Newnes",,"http://www.sciencedirect.com/science/book/9780750684552"
"9780750686129","Centrifugal Pump Handbook (Third Edition)",2010,,,"Butterworth-Heinemann",,"http://www.sciencedirect.com/science/book/9780750686129"
"9781856177108","Clean Coal Engineering Technology",2010,,,"Butterworth-Heinemann",,"http://www.sciencedirect.com/science/book/9781856177108"
"9781856177450","Modern Chemical Enhanced Oil Recovery",2011,,,"Gulf Professional Publishing",,"http://www.sciencedirect.com/science/book/9781856177450"
"9780123808820","Handbook of the Psychology of Aging (Seventh Edition)",2011,,"Handbooks of Aging","Academic Press",,"http://www.sciencedirect.com/science/book/9780123808820"
